title,price,description,rating,image
Benchmade Hidden Canyon Fixed-Blade Knife,$162.00,"Despite its compact profile, the Benchmade Hidden Canyon fixed-blade knife provides ample real estate throughout the handle and cutting edge, making it just as effective on big tasks as smaller ones.",4.8,https://www.rei.com/media/0b9b0c6f-e93b-485d-9e44-fe60a270a629?size=784x588
Benchmade 15080-2 Crooked River Knife,$261.00,"For everyday carry or an essential tool for the trail, the Benchmade 15080-2 Crooked River knife offers a traditional profile with modern technology and style.",4.7,https://www.rei.com/media/1641d7a6-ab4b-494e-9816-8ed749ec3f15?size=784x588
Benchmade 15017-1 Hidden Canyon Fixed-Blade Knife,$207.00,"Though compact, the Benchmade 15017-1 Hidden Canyon Hunter fixed blade knife delivers an improved cutting edge and ergonomic grip to effortlessly handle any cutting task, big or small.",4.4,https://www.rei.com/media/3c87c2ae-3e97-4f4b-94b9-18379df5c5ff?size=784x588
Swiss Army Classic Knife,$20.00,"The lightweight, all-purpose Swiss Army Classic Knife includes scissors, blade, screwdriver, nail file, tweezers and a toothpick.",4.9,https://www.rei.com/media/8c6b7ff2-600c-4ea1-ba0a-1ec320bbff0f?size=784x588
Leatherman Raptor Medical Shears,$89.95,"When it's a question of survival, the Leatherman Raptor medical shears answers loud and clear with the necessary tools to quickly go to work in an emergency situation.",4.6,https://www.rei.com/media/b65f869d-852b-4b9c-b9c2-a21bf6e26fbb?size=784x588
Vortex Diamondback HD 16-48 x 65 Angled Spotting Scope,$400.00,See a tail twitch in low light or pick a bird out of dense cover with the clarity of the Vortex Diamondback HD 16–48 x 65 angled spotting scope.,5.0,https://www.rei.com/media/541d55c6-ae04-4c9f-956a-25c4ab0052b9?size=784x588
