title,brand,price,description,rating,image,feature
ENO Ember Hammock Underquilt,ENO,$83.89,Summer's over but you still want to hammock camp? The ENO Ember hammock underquilt is built with 2 layers of heat-trapping synthetic insulation to keep you toasty on your next hang out session.,4.4,https://www.rei.com/media/6cf96c7f-d8c6-4f52-8a79-f78149937a0e?size=784x588,"['40–60°F temperature recommendation when paired with a comparable top quilt (not included)', 'Fully adjustable suspension adapts to any sleep position and is compatible with all ENO® hammocks (hammock not included)', 'Differential baffle construction eliminates cold spots and ensures maximum loft', 'Durable water repellent (DWR) finish and specialized coating provide wind and weather resistance', 'Comfortably fits users up to 6\' 2""']"
GCI Outdoor Freestyle Rocker Chair,GCI Outdoor,$75.00,"Kick back and relax at the campground with the smooth rocking motion of this sturdy, travel-friendly chair.",4.6,https://www.rei.com/media/888407c1-cebc-4eff-a649-bd5032260160?size=784x588,"['Shocks in back provide a smooth and relaxing rocking motion on hard or soft ground', 'Powder-coated steel frame supports up to 250 lbs.', 'Includes padded armrests for good comfort', 'Pocket on the side keeps a beverage within reach', 'GCI Freestyle Rocker™ chair folds down quickly and easily for transporting to and from the campsite']"
ENO Blaze Hammock Underquilt,ENO,$209.89,"Protecting you from wintry weather during your overnight adventures, the ENO Blaze hammock underquilt is built with exceptionally warm and sustainably sourced 750-fill-power DownTek® down.",5.0,https://www.rei.com/media/276cde24-c02d-41e4-9236-50a3018b2c51?size=784x588,"['30–40°F temperature recommendation when paired with a comparable top quilt (not included)', 'Fully adjustable suspension adapts to any sleep position and is compatible with all ENO® hammocks (hammock not included)', 'Differential baffle construction eliminates cold spots and ensures maximum loft', 'Durable water repellent (DWR) finish and specialized coating provide wind and weather resistance', 'Includes an ultralight stuff sack', 'Comfortably fits users up to 6\' 2""']"
REI Co-op + West Elm Outward Rope Chair,REI Co-op + West Elm,$89.95,"We designed the outdoor-ready frame. They designed the climbing-inspired seat. Together, we hope the REI Co-op + West Elm Rope Chair helps you spend more time out there—in the backyard or backcountry.",3.7,https://www.rei.com/media/a58a8f15-5547-4eee-8d2d-801427adfb8c?size=784x588,"['Climbing-inspired rope seat provides comfort and support', 'Durable powder-coated steel frame will stand up to years of use', 'Bifold design allows easy setup and takedown', 'Rope handle makes for easy carrying and storing', '250 lb. weight capacity']"
Mountain Summit Gear Heavy-Duty Roll-Top Table - Medium,Mountain Summit Gear,$99.95,"Lightweight, sturdy and weather-resistant, the medium Mountain Summit Gear Heavy-Duty Roll-Top table sets up in under a minute and then folds away small for easy carry and storage.",5.0,https://www.rei.com/media/f1dbec28-b365-4ce4-8ad5-58e99999c2c6?size=784x588,"['Aluminum roll-top and weather-resistant steel frame', 'Roll-up top and folding frame set up in under a minute', 'Folds and stores away in a compact and easy to carry bag']"
ENO HouseFly Rain Tarp,ENO,$118.89,"Part rain tarp, part luxurious waterproof fortress, the ENO HouseFly rain tarp features silicon-impregnated nylon sides that keep you warm, dry and comfortable while you lounge in your hammock.",4.9,https://www.rei.com/media/9f844467-7f13-401d-8a6a-2f67e9b894c7?size=784x588,"['Overlapping doors allow easy access to the inside while keeping out weather nastiness', 'ENO HouseFly boasts the most coverage of all the ENO rain tarps', 'Stowable doors allow you to laze in cool shade on a nice day', 'Includes a stuff sack']"
Crazy Creek Hex 2.0 LongBack Chair,Crazy Creek,$74.95,"Clip the Crazy Creek Hex 2.0 LongBack chair to your pack and go. This lightweight, packable seat is ideal when space and weight matter, and it offers extra width and height for expansive comfort.",4.4,https://www.rei.com/media/fb260f1c-a03d-4618-a564-73d2fea875fe?size=784x588,"['The Hex 2.0 LongBack has the same features as the Hex 2.0 Original but is 2 in. wider and 4 in. higher at the back for added comfort', '8 mm high-density cored EVA closed-cell foam provides insulation and comfort without added bulk', 'Outer shell of durable 210-denier coated ripstop nylon protects you from wet ground', 'Inner surface of water-resistant, breathable 70-denier coated ripstop nylon is durable and easy to keep clean, and seals out sand and dirt', 'Virtually unbreakable carbon-fiber stays lend support', 'Tight-knit nylon webbing provides superior tensile strength', 'Reinforced wing connection adds durability', 'Rolls up compactly to a 4 in. diameter; features an attached roll-up strap and hanging loop for convenience', 'Manufacturer offers a limited lifetime warranty on this product']"
Crazy Creek Smokey Bear Original Chair,Crazy Creek,$64.95,"Easy to bring along for everything from camping trips to concerts, the Crazy Creek Smokey Bear Original chair provides a dry, comfortable seat wherever you are—and whenever you'd like.",4.0,https://www.rei.com/media/4921f2b4-5cfa-4c65-8742-a6d2d6ae5f56?size=784x588,"['Lightweight and easy to carry', 'Non-PFOA C6 durable water repellent (DWR) coating (C-Zero) provides protection from wet ground', ""High-density closed-cell foam provides comfy padding that won't absorb water"", 'Sturdy carbon-fiber support stays keep you upright', 'Adjustable to accommodate a wide range of sitting positions for customizable comfort', 'For every Smokey Bear product sold, Crazy Creek Products will donate 10% to the U.S. Forest Service for wildfire prevention education', ""Covered by manufacturer's limited lifetime warranty""]"
Kammok Roo Double Recycled Hammock,Kammok,$84.95,"Perfect for two, compact for travel and made from 100% recycled fabric, the Kammok Roo Double Recycled hammock delivers unparalleled quality and performance from backyard to backcountry.",4.9,https://www.rei.com/media/327b8d65-1313-4bed-b66e-43a60ef21ba0?size=784x588,"[""Supersoft GravitasX™ 40-denier diamond ripstop fabric is 100% recycled; it's made with preconsumer waste that would otherwise be discarded as trash"", 'Fabric is also bluesign® approved', 'Kammok reduced the use of virgin nylon while maintaining the same durability and performance needed in the backcountry—the Roo Double Recycled safely holds up to 500 lbs.', ""At 10 ft. long, there's plenty of room to lie flat and stretch out for the best night of sleep or share a seat for 2 on the patio"", 'Exclusive crinkle treatment breaks in the fabric ahead of time, ensuring out-of-the-package softness and exceptional packability', '23kN Kanga Claw™ carabiners and Dyneema® Racer slings create a climbing-strength suspension', 'Attach carabiners, gear accessories and more to the built-in gear loops', ""At only 1 lb. 1.1 oz., this hammock won't weigh down your pack"", 'Made of 100% recycled Diamond Shell™ 40-denier diamond ripstop nylon fabric, the attached roll-top stuff sack provides quick, water-resistant storage', 'Note: Hammock straps are not included', ""Covered by Kammok's lifetime warranty, so you can be confident your gear will outlast your adventures; see vendor website for details""]"
Dometic GO Compact Camp Table,Dometic,$199.95,"When it comes to camping, space matters. Make the most of yours with the Dometic GO Compact Camp table. It switches between 3 heights for dining, chilling out or giving the little ones a craft spot.",5.0,https://www.rei.com/media/2d901fed-7dc4-476f-80c4-438518e0bd75?size=784x588,"['Seats 4 adults', ""Adjustable legs provide 3 table heights: coffee table, kids' table, or dining and food prep table"", 'Made from solid bamboo with aluminum legs; legs attach to the corners of the table for more room underneath', 'Includes integrated handle for easy transfers and setup; collapses to half its size to fit easily in your trunk']"
GCI Outdoor Compact Camp Table 20,GCI Outdoor,$45.00,The GCI Outdoor Compact Camp Table 20 features a 1-piece compact design that allows it to fold up to half the size of other camp tables for easy transport to your campsite.,4.5,https://www.rei.com/media/eb72d191-ee35-4f51-93b8-30cd3e06c847?size=784x588,"['Ideal for camping, tailgating, fishing and sporting events', 'Aluminum frame and heat-dissipating aluminum tabletop support up to 60 lbs.', 'Includes telescoping legs that allow this full-size table to fold compactly', 'GCI Outdoor Compact Camp Table 20 folds up quickly and easily to take up little space in your car']"
Hennessy Hammock Expedition Asym Zip Hammock,Hennessy Hammock,$169.95,"This comfortable, asymmetric hammock has a side entry, double-slider zipper and large, protective rainfly that make it perfect for those who like to travel light.",4.4,https://www.rei.com/media/194df825-019d-4c4a-9006-e49007a24384?size=784x588,"['Asymmetric hammock bed improves comfort; asymmetric rainfly improves coverage', 'Provides comfort for those up to 6 ft. and 250 lbs., with more room for shoulders at one end', 'Strong #10 zipper features double sliders for easy adjustments to the hammock and mesh', 'Entry is from the side on this Hennessy model', 'Patented integral ridgeline maintains the same comfortable shape every time to keep your back straight and level when resting on the diagonal', 'No-see-um mesh provides excellent insect protection and ventilation, and will deflect wind to provide a calm space inside', 'Waterproof polyester ripstop rainfly may be tilted to any angle, rolled up above, removed or used separately; large rainfly offers  ample protection', 'Nifty gear pocket slides on the ridgeline and stores out of sight behind your head', 'Suspension system includes 10 ft. long, 1500 lb. test low-stretch polyester core ropes with polyester cover', 'Complementary polyester webbing straps are attached to the end of the suspending ropes to protect the tender bark of trees and provide greater span for the ropes', 'Hammock folds into an open-air lounger / chair or can be used on the ground as a tent when paired with your hiking poles']"
Mountain Summit Gear Aluminum Folding Picnic Table,Mountain Summit Gear,$174.95,"Ideal for outdoor gatherings, the Mountain Summit Gear Aluminum Folding Picnic Table lets you bring comfort and convince wherever you roam—just add friends, family and food.",4.1,https://www.rei.com/media/60a2dc5f-27d8-49ba-aebf-c136e6ded42a?size=784x588,"['Aluminum slat sheets and engineered composite tabletop are lightweight, durable and weather resistant', 'Folds and stores easily with self-packing design', 'Quick and easy setup', 'Umbrella stand hole in tabletop']"
Eureka Camp Table,Eureka,$124.95,"Pull up your chairs and join in the fun with the Eureka Camp Table. Generously sized and able to support up to 90 lbs., this sturdy, hard-top table is ideal for meals, games and other camp activities.",4.7,https://www.rei.com/media/87f42ec5-3e71-4954-b7f0-2478d0264a05?size=784x588,"['Easily level the table on uneven ground using the adjustable, anti-rocking foot', 'Sturdy, hard-top table surface supports up to 90 lbs.', 'Includes a convenient carry bag']"
ENO Vulcan Hammock Underquilt,ENO,$125.89,"With 2 layers of PrimaLoft® insulation for superior warmth during your hammock adventures, the ENO Vulcan hammock underquilt is built to protect you from a range of inclement weather conditions.",4.3,https://www.rei.com/media/f2b2b60d-397a-410b-a467-97348cd83cdb?size=784x588,"['30–50°F temperature recommendation when paired with a comparable top quilt (not included)', 'Fully adjustable suspension adapts to any sleep position and is compatible with all ENO® hammocks (hammock not included)', 'Dual-layer PrimaLoft insulation with offset-quilted construction eliminates cold spots and ensures maximum loft', 'Durable water repellent (DWR) finish and specialized coating provide wind and weather resistance', 'Includes a large mesh storage bag', 'Comfortably fits users up to 6\' 2""']"
ENO SubLink Hammock Shelter System,ENO,$185.39,"Expertly hit the trails with a shelter that keeps you dry, comfy and bite-free. The ENO SubLink hammock shelter system helps you easily catch zzz's and fend off anything the trail throws your way.",4.3,https://www.rei.com/media/cda6dd54-3769-4b6c-9d2c-467859196f34?size=784x588,"['Includes: Sub6™ hammock, Helios™ suspension system, Guardian™ SL bug net, ProFly™ Sil rain tarp and storage bag', 'Super-lightweight hammock is constructed with strong, breathable and fast-drying 30-denier ripstop nylon', 'Hammock features aluminum toggles that quickly and securely connect to the Helios suspension system', 'Suspension system made with superstrong Silverlite™ ensures the perfect hang with its Microtune™ adjustment system and No-Knots-Needed setup', 'Bug net constructed from SkyWeave™ Lite Mesh boasts a streamlined shape with 360° insect protection, perfect for the minimalist camper or ultralight backpacker', 'Bug net features an integrated ridgeline for sleeve-like access, a J-Shaped Zipper for fast access and a quick No-Knots-Needed setup', 'Rain tarp is streamlined and ultralight, great for weathering sudden downpours and building shaded basecamp hangouts; includes 4 DAC aluminum stakes', 'Tarp features reflective cord for nighttime visibility, double-stitched waterproof seams and a quick No-Knots-Needed setup for convenience', 'Water-resistant roll-top storage bag is built from durable 70-denier ripstop nylon', 'ENO plants 2 trees for every hammock sold through their partnership with Trees for the Future', 'ENO is a member of the 1% For The Planet organization, donating 1% of sales to environmental nonprofits']"
Helinox Cot One Leg Conversion Kit,Helinox,$99.95,Increase your comfort when you increase the height of your Cot One Convertible with the Helinox Cot One leg conversion kit.,4.3,https://www.rei.com/media/635c63e9-72d2-4535-9fed-2bc9f5c1a6ec?size=784x588,"['Bringing your Cot One Convertible (sold separately) up to a height of 15 in. makes it easy to get in and out of your sleeping bag', 'Includes 12 pieces']"
ENO Lounger SL Chair,ENO,$66.39,"Seat yourself in comfort at campsites, festivals and backyard parties with the lightweight, low-profile ENO Lounger SL chair. It offers premium construction for strength and stability.",4.2,https://www.rei.com/media/05e4d9b1-f88f-4764-a273-6d35910182c4?size=784x588,"['This compact and portable chair features breathable mesh seat material and a stretch cargo pocket', 'Sturdy aluminum frame sets up and packs down fast']"
GCI Outdoor Sunshade Rocker Chair,GCI Outdoor,$90.00,"Rock, relax and enjoy while staying protected from the sun with the GCI SunShade Rocker chair. The built-in SPF SunShade™ shields you from the sun so you can eliminate the burn from your beach days.",3.8,https://www.rei.com/media/de442b8c-4a25-40aa-b195-ad4bc89be021?size=784x588,"['Adjustable SPF SunShade rotates front to back and can collapse flat; UPF 50+ fabric shields you from harmful UV rays', 'Patented Spring Action Rocking Technology™ delivers smooth rocking while you enjoy the views', 'Durable nylon mesh backrest for continual airflow', 'Includes an accessory pocket for a cellphone and a beverage holder for your drink', 'Includes a carry bag with wide-mouth opening to make stowing the chair simple; bag has a built-in carry strap for easy transport', 'Supports weight up to 250 lbs.']"
Neso Beach Chair XL,Neso,$69.95,"Soak up the sun in comfort with the Neso Beach Chair XL. Built with a padded, rustproof frame with water-resistant canvas, it's wide, roomy and high enough to easily kick back and relax.",4.0,https://www.rei.com/media/9139557f-7b3e-4fc9-94b1-9ff663d8cd1b?size=784x588,"['Chair folds flat and includes a carrying strap for easy transport', 'Lightweight design sits comfortably and stays stable in sand', 'Back storage pocket stashes snacks, sunscreen and other beach necessities', 'Water-resistant canvas and rustproof aluminum offer durability against moisture', 'Padded frame keeps you comfy']"
NEMO Moonlander Table,NEMO,$149.95,"Whether you're on the beach, camping in the woods or gathering in the backyard, the NEMO Moonlander camp table provides a clean, stable surface for preparing and serving meals outside.",4.4,https://www.rei.com/media/945ebc31-917d-48b0-b73e-3b7f47053129?size=784x588,"['Sets up like a charm: Simply open for picnic level or connect and insert poles with a twist for side table height', 'Smooth, durable tabletop is made of heat-stable nylon to endure the elements and clean easily', 'Dual-height design offers both a low picnic-blanket setup and deploys hidden legs to setup as an elevated side table', 'Picnic height (intended to be used without chairs) is 4 in.; side table height is 16 in.', 'High-quality hardware brings next-level detail and durability, and a clean aesthetic', 'Custom-engineered aluminum hinges are blind-molded into the tabletop for a lifetime of performance', 'Solid aluminum legs are integrated with carbon fiber and zinc pole tips for a stable and supportive outdoor camp table', 'Includes a padded case that simply slips over the packed table; packed size is small enough to fit in the laptop sleeve of a backpack', 'Protected by the NEMO lifetime warranty']"
Mountain Summit Gear Camp Roll Top Kitchen,Mountain Summit Gear,$129.95,"Set up your camp kitchen in less than a minute, then break it down just as quickly. The durable Mountain Summit Gear Camp Roll Top kitchen sets the standard in ease of use and fast setup/takedown.",4.5,https://www.rei.com/media/23a0c4b2-83f1-4543-b322-e194e27b13c7?size=784x588,"['Lightweight and sturdy weather-resistant aluminum frame has adjustable legs', '1 foldout counter and 2 roll-top table surfaces', 'Stores conveniently in the included carry bag']"
Mountain Summit Gear Loveseat,Mountain Summit Gear,$99.95,"Camp, attend sporting events or lounge in your backyard in comfort with the Mountain Summit Gear Loveseat. It has a durable, oversize frame that supports up to 500 lbs.",4.7,https://www.rei.com/media/9c30f97b-1a11-49a1-babb-25aeb53350be?size=784x588,"['19mm steel frame is powder coated for added durability', 'Includes a carry bag with strap for ease of transport and storage', 'Weight capacity: 500 lbs. (226.79 kg) for entire loveseat; 300 lbs. (136.07kg) per seat']"
Helinox Helinox Table One,Helinox,$139.95,Upgrade your picnic game with the Helinox Table One and be the envy of all the free summer concertgoers in your local park. It includes 2 inset cup holders and is a must-have in any travel kit.,4.6,https://www.rei.com/media/20f6cbdc-1d11-473f-ad81-1e7f0078c142?size=784x588,"['At 1.3 lbs. and 14.2 in. high, the table works best when used with Helinox-height chairs as it sits low to the ground (chairs sold separately)', 'Single shockcorded pole structure makes it simple and quick to set up and take down', 'Storage bag with zipper closure and grab handles', 'Not designed for use as a seat']"
ENO DryFly Rain Tarp,ENO,$59.39,Rest easy in your hammock and enjoy the soothing sound of the rain with the ENO DryFly rain tarp.,4.4,https://www.rei.com/media/a97583a4-5d48-451e-900b-2945fc7281d3?size=784x588,"['Polyurethane-treated ripstop nylon offers long-lasting wear with excellent water-shedding capabilities', 'Unique shape provides lots of coverage to keep you and your gear dry', 'Designed specifically for ENO hammocks (sold separately); also works well with other brand hammocks', 'Use independently to shelter equipment, clothes, your backcountry kitchen or your dog', 'ENO DryFly rain tarp has a built-in stuff stack for convenient packing']"
Parks Project Camp Chair,Parks Project,$76.93,"Adorned with trees and perfect for lounging, this Parks Project camp chair helps you sit back and enjoy your surroundings. It's light and easy to bring along on any camping trip.",0.0,https://www.rei.com/media/c10f8de9-38d1-4eed-8ee9-b6f1cb336423?size=784x588,"['Anti-sink disk feet are ideal for camping', 'High-strength plastic reinforcements and bar tack sewing add durability', 'Features a Feel the Earth Breathe graphic']"
FIRESIDE OUTDOOR Pop-Up Fire Pit,FIRESIDE OUTDOOR,$119.95,"The FIRESIDE OUTDOOR Pop-Up fire pit is a portable wood or charcoal-burning fire pit. Its state-of-the-art design allows quick, easy assembly—then it collapses and packs away in a moment's notice.",4.7,https://www.rei.com/media/5bfd265d-64b4-4a5f-8031-0b59e99575d0?size=784x588,"['Lightweight, portable design makes it the perfect companion from the backyard to the backwoods', 'Patented Fire Mesh technology produces captivating flames and substantial heat output, creating bright, hot fires with 80% less smoke for a more enjoyable campfire experience', 'Opens to 24 in. x 24 in. when fully assembled', 'Aluminum and stainless-steel construction provides years of corrosion-free use', 'Burns multiple types of fuel, including charcoal, wood and wax logs', 'The included Leave No Trace Heat Shield lets you have a fire on any surface without damaging the underneath ground', 'Zippered weather-resistant carrying bag included', 'Meets all USFS and BLM fire pan regulations']"
Kammok Bobcat 45 Down Trail Quilt,Kammok,$199.95,"With a poncho opening for hands-free, wearable warmth, the Kammok Bobcat 45°F Down Trail quilt adapts to your adventure, serving as a backpacking sleeping bag, hammock underquilt or cozy camp blanket.",4.8,https://www.rei.com/media/4139cf93-95ad-4fa9-b34d-f79580961c6b?size=784x588,"['As a lighter alternative to a classic sleeping bag, the Bobcat includes sleeping pad straps and shockcords at the feet and shoulders to hold in warmth', 'The included hammock underquilt conversion kit lets you snap the Bobcat to the gear loops of Roo hammocks and hammock tents (not included)', 'Poncho mode lets you enjoy hands-free, wearable warmth; 2 snaps close the poncho opening for use as a cozy, draft-blocking blanket', 'Downtek™ 600-fill-power duck down provides cozy warmth at camp for cool nights at or above 45°F', 'Treated with a PFC-free durable water repellent (DWR) finish, this down absorbs 30% less water and drys 60% faster than untreated down', ""Geometric triangle pattern with stitch-through construction maintains the down's loft and holds it securely in place, trip after trip"", 'Atmos X™ 20-denier ripstop nylon shell is treated with DWR finish to fend off tent condensation and drink spills', 'Ripstop material is durable, lightweight and abrasion-resistant, with a buttery-soft feel to keep you comfortable throughout the night']"
GCI Outdoor Zero Gravity Chair,GCI Outdoor,$90.00,"For complete comfort and relaxation, sink into the GCI Outdoor Zero Gravity chair. It mimics the feeling of weightlessness in space, reduces back pressure and tension and provides lumbar support.",3.9,https://www.rei.com/media/9bad2fb4-d70a-4d52-8bf0-fe7d6c15b76f?size=784x588,"['Powder-coated steel frame reclines for maximum comfort; position lock keeps you reclined or upright', 'Headrest adjusts to match your height', 'Cup holder keeps your beverage within reach', 'Folds easily for portability']"
Kammok Mantis Ultralight All-in-One Hammock Tent,Kammok,$269.95,"Lighten your load so you can lengthen your journey. Suspended with ultralight straps, the Kammok Mantis Ultralight hammock tent features a silky, soft hammock, mesh canopy and customizable rainfly.",4.5,https://www.rei.com/media/1fabba76-224e-47b7-86b2-ab083157becf?size=784x588,"['Created from ultralight Levitas™ 20-denier ripstop nylon for a high strength-to-weight ratio', 'Included Python 10 Ultralight straps are constructed with SpiraLine™, a fiber 15x stronger than steel and light enough to float on water', 'Hammock is enclosed in a Dragonet™ no-see-um mesh canopy to keep insects at bay', 'Features built-in pockets and a structural ridgeline to keep what you need close at hand', 'When the weather is nice and the night sky is clear, roll back the fly and look through the Stargazer™ panel, which provides exceptional contrast with the night sky', 'Lighter than your tent and easier to set up, the portable Mantis Ultralight hammock tent takes camp setup to 60 seconds with a knotless suspension', 'Early morning starts just became easier, too, with a quick teardown of camp', 'Covered by the Kammok lifetime warranty so you can be confident your gear will outlast your adventures; see vendor website for details']"
