title,brand,price,description,rating,image,feature
REI Co-op Outward Low Lawn Chair,REI Co-op,$89.95,"It's that chair from your childhood, but way more durable. The REI Co-op Outward Low Lawn Chair is made with a coated aluminum frame and a water-repellent ripstop seat. Plus, it has backpack straps.",4.4,https://www.rei.com/media/81adf443-ac27-4c24-9aa9-dcebe876275b?size=784x588,"['Heavy-duty ripstop nylon seat is highly abrasion resistant and treated with a durable water repellent (DWR) finish to repel light rain and stains', 'Sets up and takes down easily with bifold design', 'Backpack straps and a carry handle make for easy transport', 'Secure closure system allows you to use the folded chair as a catchall for blankets or other items, like the Outward Side Table (not included)', '250 lb. weight capacity']"
ENO Atlas Hammock Suspension System,ENO,$20.89,"ENO designed the Atlas hammock suspension system with 3 things in mind: strength, security and ease. This no-knots-needed setup will have you relaxing securely in seconds.",4.8,https://www.rei.com/media/abe96871-4e83-4a91-a08c-e1ba29160268?size=784x588,"['Includes 2 straps per package; hammock not included', 'Each strap is 9 ft. long, allowing you to wrap it around big trees; straps can also be attached to roof rack, rocks or whatever else you can find', 'Straps are designed specifically for ENO hammocks but work with most hammocks on the market', '30 combined adjustment points', 'Tapered design helps to decrease strap weight to a mere 9 ounces, while ensuring increased tree protection', 'Each strap in the ENO Atlas hammock suspension system can support 200 lbs., for a combined weight capacity of 400 lbs.', 'Reflective stitching increases nighttime visibility']"
ENO Lounger DL Chair,ENO,$97.89,"Your ticket to serious relaxation—the nap-worthy ENO Lounger DL chair comes with 2 adjustable leg heights (3 and 10 in.), a cup holder, 2 cargo pockets and an integrated pillow.",4.2,https://www.rei.com/media/96808510-c32b-4db0-99b6-6c0646dc9879?size=784x588,"['Effortless shockcorded assembly makes this lightweight chair perfect for the quad, your favorite festival or around the campfire', 'Includes a stuff sack']"
ENO SingleNest Hammock,ENO,$38.39,"Perfect for one, the compact and lightweight ENO SingleNest hammock is expertly constructed with durable yet soft FreeWave™ fabric, making it ideal for solo relaxation on any kind of adventure.",4.9,https://www.rei.com/media/06902ef9-54b5-4efb-990d-b197a91caadd?size=784x588,"['Updated with supremely comfortable, breathable and fast-drying FreeWave™ fabric', 'Made with exclusive crinkle treatment for exceptional softness and packability', 'Extended 9.5 ft. hammock body creates more room to stretch out, lay flat and relax', 'Time-tested, triple-stitched seam construction creates unmatched durability and protection against ripping or tearing', 'Refreshed hardware includes a custom side-release buckle and larger cordlock for easy setup and pack-up every time', 'Integrated stuff sack compresses the hammock to a travel-ready size and now offers a bonus internal stash pocket to store a phone or drink', 'Weighing in at just 16 oz., the SingleNest packs down to the size of a mango and is light enough to take anywhere', 'Specially designed carabiners easily attach to all ENO hammock straps or other secure anchor points and help maintain correct orientation for a safer, easier hang', 'Straps and suspension system not included', 'Compatible with all ENO hammock straps, stands, bug nets, rain tarps and insulation systems (not included)', 'ENO plants 2 trees for every hammock purchase through their partnership with Trees for the Future', 'ENO is a member of the 1% For The Planet organization, donating 1% of sales to environmental nonprofits']"
Crazy Creek Original Chair,Crazy Creek,$41.93,"Get a dry, comfortable seat wherever you are, whenever you'd like, with this Crazy Creek Original chair. It's easy to bring along on camping trips or to sports games, concerts, festivals or the beach.",4.6,https://www.rei.com/media/330a7142-27f0-4018-99cf-152689f811e5?size=784x588,"['Lightweight chair is easy to carry; carry handles and hook-and-loop straps keep the chair folded during transport', 'Coated fabric provides protection from wet ground', ""High-density closed-cell foam provides comfy padding that won't absorb water"", 'Sturdy carbon-fiber support-stays keep you upright', 'Chair is adjustable for a wide range of sitting positions for customizable comfort', 'Features 420-denier coated ripstop nylon on solid styles, and 600-denier coated polyester on printed styles', 'Weight capacity: 250 lbs.']"
ENO SoloPod Hammock Stand,ENO,$209.89,"Tired of wishing for the perfect trees to appear in your desired hammock spot on a road trip, at a festival, or when car camping? Look no further than the patent-pending ENO SoloPod hammock stand.",4.6,https://www.rei.com/media/11ccd8e2-18ef-4eae-917f-1e866ac50aa8?size=784x588,"['Smooth construction, graceful aesthetics and versatile, nonslip feet make the SoloPod a convenient and good-looking single-hammock stand', 'SoloPod packs down quickly for easy portability; from poolside to the campground, you\'ll never have to say ""no"" to hammocking again', 'Fits 1 ENO hammock (sold separately)', 'Comes with steel carabiners to work with any ENO hammock', 'Breaks down into 8 pieces for easy portability', 'Nonslip feet are perfect for smooth surfaces', 'Quick-release, tool-free construction']"
Kammok Swiftlet Hammock Stand,Kammok,$279.95,"No longer binding you to the perfect pair of trees, the Kammok Swiftlet hammock stand offers comfort and freedom to hang your hammock anywhere. It's light and portable for hanging from park to patio.",4.7,https://www.rei.com/media/b20865e3-e077-47d9-82dd-c8ff80621889?size=784x588,"['Its compact size and light weight empowers car campers, tailgaters and beachgoers alike to hang anywhere—no perfect pair of trees required', 'For board game nights or apartment patios, the Swiftlet converts to chair mode, saving space and cutting the footprint in half for cramped spaces', 'Each piece of the stand slides and snaps together for a quick, intuitive assembly experience', 'Quick-release buttons and push pins eliminate the need for screws and tools', 'Padded travel bag and handy internal straps make toting the Swiftlet a breeze', 'Designed to flex and distribute weight on uneven surfaces, securely holding up to 300 lbs.', 'Built for life outdoors, the aluminum frame is rust-resistant when left out during unexpected showers', 'With 11 adjustable points on each arm, quickly slide and lock into the comfiest hang', 'Fits all Kammok hammocks from Roo Jr. to Roo Double XL (hammock not included)']"
Helinox Sunset Chair,Helinox,$169.95,"Lean back, enjoy the view. Providing plenty of neck, head and back support outdoors, this Helinox Sunset chair ups your comfort and is easy to move from one great spot to another.",5.0,https://www.rei.com/media/d80d9cca-6a30-4d79-aa59-dde77daeabec?size=784x588,"['High, supportive back panel and ergonomic design offer comfort', 'Breathable mesh on back and sides helps you stay cool', 'DAC aluminum alloy frame is lightweight yet strong; chair weighs only 3 lbs. 4 oz. but can support up to 320 lbs.', 'Adjustable headrest design provides dialed-in comfort', 'Side pockets keep small essentials off the ground and right at hand', 'Chair sets up quickly, thanks to a single shockcorded pole structure', '18.5 x 5.5 x 4.5 in. storage sack included; carry sack converts to a pillow for spontaneous snoozing', 'Manufacturer offers a 5-year warranty on this product']"
ENO ProFly Hammock Rain Tarp,ENO,$59.39,"Don't be left out in the rain! Rest easy in your hammock with this lightweight, ripstop rain tarp over your head.",4.5,https://www.rei.com/media/77aefe30-80ee-41dd-9a6a-9fdfcd154e56?size=784x588,"['Polyurethane-treated ripstop nylon offers long-lasting wear with excellent water-shedding capabilities', 'ProFly has 6 points of attachment and a rectangular shape for ample coverage to keep you and your gear dry', 'Tarp is quick and easy to set up and take down', 'Designed specifically for ENO hammocks (sold separately); also works well with other brand hammocks', 'Use independently to shelter equipment, clothes, your backcountry kitchen or your dog', 'ENO ProFly rain tarp comes with a stuff stack for convenient packing']"
Helinox Chair Zero Highback,Helinox,$169.95,"With a taller back for added support and comfort, the Helinox Chair Zero Highback has the same DNA as Chair Zero, making it a light, compact choice for camping, paddling trips, backpacking and more.",4.3,https://www.rei.com/media/690675d3-8b9b-4a19-9d24-e9e951af2626?size=784x588,"['High, supportive back panel and ergonomic design offer comfort', 'DAC aluminum alloy frame is lightweight yet strong; chair weighs only 1 lbs. 8 oz. but can support up to 265 lbs.', 'Compact size makes it easy to pack and carry', 'Sets up quickly, thanks to a single shockcorded pole structure', '5 x 16 in. storage sack included', 'To sit above snow, sand, or muddy ground, pair it with the small Helinox Chair Groundsheet (not included), which secures to the feet and distributes weight to a larger surface', 'Manufacturer offers a 5-year warranty on this product']"
ENO DoubleNest Print Hammock,ENO,$84.95,"With room for 2 to stretch out, lie flat and relax, this ENO DoubleNest Print hammock is a colorful must-have for outdoor lounging. It's easy to bring along wherever your adventures take you.",4.6,https://www.rei.com/media/294bdc19-7881-480e-8c98-4a827ced5403?size=784x588,"['FreeWave™ fabric is soft, breathable and dries fast when wet; crinkle treatment offers easy packability', 'Extended 9.5 ft. hammock body creates more room to stretch out and chill', 'Integrated stuff sack compresses hammock to the size of a grapefruit for easy packing; bonus internal stash pocket holds your phone or water bottle', 'Triple-stitched seam construction protects against rips and tears', 'Light weight makes it an easy choice for any trip', 'Refreshed hardware includes a custom side-release buckle and larger cord lock for easy setup and pack up every time', 'Specially designed carabiners easily attach to all ENO hammock straps or other secure anchor points and help maintain correct orientation; suspension system not included', 'Compatible with all ENO hammock straps, stands, bug nets, rain tarps and insulation systems (not included)', 'ENO plants 2 trees for every hammock purchase through their partnership with Trees for the Future', 'ENO is a member of the 1% For The Planet organization, donating 1% of sales to environmental nonprofits']"
Snow Peak Low Beach Chair,Snow Peak,$169.95,"Stretch out and relax at the beach or barbecue with the Snow Peak Low Beach chair, which features a low seat height and a collapsible design that stows easily in the included case.",4.9,https://www.rei.com/media/cbf05ee4-3934-4055-af17-90616356a7d2?size=784x588,"['Rugged canvas fabric is accented with bamboo wood armrests and an aluminum frame', 'Chair folds and stows in the included carrying case for simple transport']"
ENO Guardian Bug Net,ENO,$45.39,Rest peacefully in your hammock without the bother of bugs with this ENO Guardian bug net.,4.5,https://www.rei.com/media/39040c61-4605-4436-8f42-279d5357ad87?size=784x588,"['Quick and easy setup minimizes your exposure to annoying insects', 'Built-in compression stuff sack makes for easy transport', 'Stuff sacks come in assorted colors; color of the bug net is black', 'Compatible with all ENO hammocks']"
Neso Beach Chair,Neso,$59.95,"Dig your toes in the sand and enjoy the salty breeze in the Neso beach chair. It comes with a carrying strap for easy transport to the lake, the ocean or a concert in the park.",4.0,https://www.rei.com/media/21679064-60dc-4dff-9c22-9fbdf4e66119?size=784x588,"['Chair folds flat and includes a carrying strap for easy transport', 'Lightweight design sits low to the ground and stays stable in sand for comfort', 'Back storage pocket stashes snacks, sunscreen and other beach necessities', 'Water-resistant canvas and rustproof aluminum offer durability against moisture', 'Padded frame keeps you comfy']"
LA SIESTA Brisa Hammock,LA SIESTA,$44.93,"The stress-free choice for easy, breezy backyard relaxation, the LA SIESTA Brisa hammock has a weather-resistant fabric that can be left out all season for carefree comfort.",0.0,https://www.rei.com/media/1d215df4-2768-4760-ba38-8a2c8f085c00?size=784x588,"['Tearproof and resistant to damage from mold, mildew and UV rays, the durable, weatherpoof fabric can be left out all season', 'Multi-cord design creates optimal weight distribution for a feeling of weightlessness and supreme comfort', 'Edges are reinforced to withstand wear and tear', 'Sized to hold 1-2 people; maximum weight capacity of 355 lbs.', 'Minimum required hanging distance: 10 ft. 2 in. (310 cm)', 'Bed width: 5 ft. 3 in. (160 cm); cloth length: 7 ft. 7 in. (230 cm); total length: 11 ft. 6 in. (350 cm)', 'Hammock is machine washable', '2-year manufacturer warranty', 'Compatible with LA SIESTA TreeMount and CasaMount suspension systems (not included)']"
ENO Atlas XL Hammock Suspension System,ENO,$27.89,Got the perfect hammock and the perfect trees but your suspension system won't quite reach? The ENO Atlas XL hammock suspension system boasts an extra 42 in. of length and 40 total attachment loops.,4.7,https://www.rei.com/media/103ceada-39ee-46ff-b77f-8cc1abdb95c4?size=784x588,"['Includes 2 straps per package; hammock not included', 'Straps are designed specifically for ENO hammocks but work with most hammocks on the market', 'No-knots-needed setup', 'Features an added 42 in. of length', '30 combined adjustment points', 'Tapered design helps to decrease strap weight to a mere 13 ounces, while ensuring increased tree protection', 'Each strap in the ENO Atlas hammock suspension system can support 200 lbs., for a combined weight capacity of 400 lbs.', 'Reflective stitching increases nighttime visibility']"
REI Co-op Camp Chair - Kids',REI Co-op,$39.95,"Let your young ones enjoy a comfortable spot by the campfire just like you with this strong, sturdy and kid-friendly chair.",4.8,https://www.rei.com/media/da4d7d96-348a-42bc-abb8-9cdca7eaebbb?size=784x588,"[""Camp Kids' chair is lightweight and portable so you can take it to the campsite, sporting event or backyard barbecue"", 'Constructed of heavy-duty, thick-walled steel for enduring strength; powder coating keeps the steel frame looking nice for years of use', 'Includes a kid-friendly pocket for beverages and other small items on the right armrest', 'Integrated strap keeps the chair closed and doubles as a shoulder strap for simple transport', ""REI Camp Kids' chair packs down to 5 x 25 in. and weighs 4 lbs.""]"
Mountain Summit Gear Heavy-Duty Roll-Top Table - Large,Mountain Summit Gear,$129.95,"The perfect spot to plan your route, prep your meal or start a game of cards after a long day, the large Heavy-Duty roll-top table from Mountain Summit Gear is a must-have for your next camping trip.",4.2,https://www.rei.com/media/4b25ece3-cb10-4768-bed4-0d03081ffc53?size=784x588,"['Aluminum roll-top table provides a large, stable surface for meals, games, prep and more', 'Lightweight and sturdy weather-resistant frame adds durability', 'Sets up in under a minute', 'Folds up and stores away in a compact and easy-to-carry bag', 'Weight capacity: 70 lbs.']"
ENO SuperNest SL Hammock,ENO,$209.89,"Perfect for enjoying the breeze on hot days, the ENO SuperNest SL backyard hammock keeps you cool and comfy with an exceptionally breathable mesh body, plush pillows and 3D-contoured construction.",4.8,https://www.rei.com/media/1bd71e51-c7bc-4bbd-8dcf-e29ac9dab884?size=784x588,"[""Soothing colors collected from nature's palette create a serene environment to hang out and relax"", 'Premium mesh body is engineered for all-weather performance, optimum breathability and long-lasting strength', 'Innovative 3D-contoured construction conforms to your natural curvature to improve comfort and stability when sitting or lying down', ""Convenient dual hanging pockets with a divider keep drinks and essentials organized and at arm's reach"", 'Dual plush pillows create a symmetrical lounging experience and are removable for easy cleaning and storage', 'Marine-grade components—including 2 stainless-steel wiregate carabiners—and UV-resistant materials withstand seasonal sun, rain exposure, degradation and rust', 'ENO plants 2 trees for every hammock sold through their partnership with Trees for the Future', 'ENO is a member of the 1% For The Planet organization, donating 1% of sales to environmental nonprofits']"
Ignik FireCan Portable Fire Pit,Ignik,$149.89,"Built to bring the warm glow of a campfire to your backyard, tailgate or campsite, the Ignik FireCan fire pit easily goes wherever you do—without the limitations of a traditional wood fire.",4.4,https://www.rei.com/media/35f3db56-5d1d-43db-889f-12d70d74d4d9?size=784x588,"['Compact and durable ammo-can design is easy to store and transport', 'Removable lid includes a carrying handle', 'Folding legs set up in seconds and are quick to break down', 'Toolless, quick-release hose with adjustable regulator packs inside for an easy-to-carry package', 'Mesh sides increase visibility and transmission of heat', 'Adjustable flame radiates heat to where you need it', ""Raised, propane-burning design may be allowed during a burn ban—always check the land manager's current regulations"", 'Includes FireCan and a 5 ft. quick-release hose with adjustable regulator', 'Heat Diffuser not included', 'Fuel not included']"
Mountain Summit Gear Quick Fold Table,Mountain Summit Gear,$41.93,"With a compact design that sets up in mere seconds, the Mountain Summit Gear Quick Fold table is a superb campsite addition for playing cards, eating meals and staying organized.",4.8,https://www.rei.com/media/24c853fd-79f9-4242-b8df-12b07339942f?size=784x588,"['Lightweight and sturdy', 'Weather-resistant', 'Sets up in seconds and folds flat', 'Heavy duty storage bag/carry case included']"
Dometic GO Hydration Water Faucet,Dometic,$99.95,"Get running water without a kitchen in sight. This Dometic GO Hydration water faucet provides a steady stream of water with just a touch for cooking, filling water bottles and brushing your teeth.",4.0,https://www.rei.com/media/48165094-6c57-41eb-aaa7-0902ca027bc2?size=784x588,"['Place the pump directly on the Dometic GO Hydration Water Jug (not included) or any water container to transform it into a running water system—no external power source needed', 'Self-powered faucet includes a self-priming pump and hose with a rechargeable battery that dispenses 150 liters per charge', 'You can also mount the metallic base on your table to make food prep easy', 'Dispenses 1 liter a minute; 1-minute automatic shutoff function means you can turn it on and let it dispense without worrying about overflows or wasting water', 'Includes puck for faucet placement and a magnetic base for using faucet on other surfaces', 'Integrated LED light allows for easy use at night or in low light', 'Compact size and handles ensure easy transport between car and campsite', 'IPX4 rating means this can withstand splashing water from any angle', 'Made with BPA-free and food-grade materials']"
ENO Lounger Hanging Chair,ENO,$97.89,Kick back in the comfortable ENO Lounger™ hanging chair and you'll wonder why you've been spending so much time on your feet.,4.6,https://www.rei.com/media/3d4ea37e-b353-462b-9fec-adbfddf8692c?size=784x588,"['Hang the chair from a tree branch or other sturdy object and then adjust the position of the footrest and the angle of recline on the chair to make yourself comfortable', 'Includes a plush headrest that supports your neck', 'Keep a cold drink nearby in the attached drink holder and stash a sandwich and book in the built-in pockets', 'The ENO Lounger hanging chair is made with a sturdy 7075 aluminum frame and 210-denier ripstop nylon; chair has a weight capacity of 250 lbs.']"
Dometic GO Compact Camp Chair,Dometic,$149.95,"Folding down small, this Dometic GO Compact Camp chair easily stashes in your trunk for when-you-need-it seating. It provides a comfy spot to sit down, relax and enjoy the sunshine.",4.3,https://www.rei.com/media/a9e0461e-d791-4c3a-bb10-052d7318f626?size=784x588,"['Lightweight but sturdy, this chair is constructed from heavy-duty 600-denier fabric and aluminum with beechwood armrests', 'Rear seat pocket stashes your essentials', 'Supports up to 280 lbs.', 'Full-size chair packs down to easily fit in a car trunk; chair folds and unfolds quickly', 'Includes a carrying sack for easy transport']"
REI Co-op Trailgate Vehicle Sleeping Platform,REI Co-op,$299.00,"Move over, DIYers. Turn your car's interior into your camp bed with the REI Co-op Trailgate Vehicle Sleeping Platform. It includes a foam mattress and frame with adjustable legs for storage beneath.",3.7,https://www.rei.com/media/fe049f59-d13c-4043-8265-56ed8067dd81?size=784x588,"['2 widths available: 25 in. for maximizing gear space beside the platform and 40 in. for maximizing sleep space for two people or pets', '3 sets of adjustable legs create a level sleeping surface in a wide range of vehicle sizes, including most outdoor-style wagons and mid- to full-size SUVs', 'Lux plush-topped recycled polyester foam mattress is super comfy and deploys quickly', 'System—including adjustable frame, frame slat covers and foam mattress—breaks down and stows in carry bag for easy transport and at-home storage', 'In the vehicle, the system can be left fully deployed for quick access to a good night\'s sleep or partially deployed (""in half"") for either use of back seats or trunk storage', 'Front legs fit into footwell behind front seats; shorter middle and back legs rest on cargo area floor', 'Front legs are independently adjustable to allow leveling for a hump or wheel well', 'Footwell legs adjust between 20 and 27 in.', 'Rear legs adjust between 7 and 10 in.', 'Front legs can be swapped for the included 3rd set of shorter legs to create a flat, elevated sleeping surface outside of the vehicle or in the bed of a pickup truck', 'Corner straps center pad on platform and keep it from shifting when in use', 'Slat covers and durable pad bottom are made with recycled polyester for a lower impact on the planet']"
ENO OneLink Hammock Shelter System,ENO,$164.39,"Camp in comfort, no matter how far off the beaten path you go. The all-inclusive ENO OneLink hammock shelter system helps you catch some backcountry zzz's while staying dry and bite-free.",4.8,https://www.rei.com/media/ee11046e-7177-45ed-939e-1e84640a92f5?size=784x588,"['Includes: DoubleNest™ hammock, Atlas™ suspension system, Guardian™ bug net, ProFly™ rain tarp and storage bag', 'Small and compact when packed, the tried-and-true DoubleNest hammock helps you stretch out and lounge in comfort', 'Hammock is made with soft, breathable and fast-drying 70-denier nylon and features heavy-duty triple-stitched seams and aluminum wiregate carabiners', 'Suspension system has 30 combined adjustment points with a No-Knots-Needed setup to have you securely relaxing in seconds', 'Suspension system boasts a tapered construction to save weight and minimize impact on trees, plus reflective stitching to improve nighttime visibility', 'Bug net is made with breathable SkyWeave™ Mesh tor 360° insect protection; features a full vertical zippered entry, integrated gear loops and a quick No-Knots-Needed set up', 'Streamlined rain tarp is great for weathering sudden downpours and building shaded basecamp hangouts; includes 4 DAC aluminum stakes', 'Tarp features reflective cord for nighttime visibility, double-stitched waterproof seams and a quick No-Knots-Needed setup for convenience', 'Water-resistant roll-top storage bag is built from durable 70-denier ripstop nylon', 'ENO plants 2 trees for every hammock sold through their partnership with Trees for the Future', 'ENO is a member of the 1% For The Planet organization, donating 1% of sales to environmental nonprofits']"
ENO SoloPod XL Hammock Stand,ENO,$244.89,"Built for backyard hammocking and fresh-air naps when paired with the SuperNest hammock (not included), the ENO SoloPod XL hammock stand is a deluxe, sculptural mainstay for your patio or yard.",4.4,https://www.rei.com/media/8774748a-3499-4dc5-9dfe-ec4d60af9707?size=784x588,"['Compatible with all ENO hammocks and backyard hammocks under 14 ft. 6 in. long, including the SuperNest, SkyLoft and DoubleNest hammock (not included)', 'Quick-release, tool-free construction; optional permanent hardware included', 'Includes marine-grade stainless steel hardware and stainless steel carabiners included for use with any ENO hammock', 'Also includes chain links for hammock length versatility', 'ENO is a member of 1% for the Planet, donating 1% of sales to environmental nonprofits']"
ENO Nomad Hammock Stand,ENO,$209.89,"Now you can set up your hammock on the beach, in the desert, above treeline and anywhere in between. With the ENO Nomad hammock stand, there are no more obstacles when it comes to hammocking.",4.2,https://www.rei.com/media/4354bea4-2215-4b3b-ac8d-034851637967?size=784x588,"['Compatible with most ENO hammocks; not compatible with ENO SkyLoft, SkyLite, JungleNest or SuperNest hammocks', 'Effortlessly packs into its custom carrying case (included)', 'Lightweight aluminum alloy construction with shockcorded pole assembly', 'Integrated cargo loops', '300 lb. weight rating']"
