title,brand,price,description,rating,image,feature
REI Co-op Outward Padded Lawn Chair,REI Co-op,$44.93,"Like that chair from your childhood, except the REI Co-op Outward padded lawn chair is way comfier—thanks to the padding. Plus it's taller off the ground and has backpack straps.",4.7,https://www.rei.com/media/87e923bb-5b90-48d7-b4f0-d58b9d9513fb?size=784x588,"['5 in. taller than its low counterpart (the REI Co-op Outward Low Padded Lawn Chair)', 'Sturdy, padded ripstop polyester seat is treated with a durable water repellent (DWR) finish to shed light rain and stains', 'Bifold design allows easy setup and takedown', 'Frame is constructed of light-but-strong coated aluminum', 'Attached backpack straps and carry handle make the chair easy to transport to the park, concert or campground', 'Secure closure system lets you stash blankets and other small items inside the folded chair', 'Chair has a weight capacity of 250 lbs.', 'Wooden arms', 'Made using bluesign®-approved materials, which conserve resources and protect the health of the environment, workers and sitter (you!)']"
REI Co-op Camp X Chair,REI Co-op,$49.95,This travel-friendly chair raises the bar for comfort with exclusive X-Web technology that evenly distributes your weight to make your campfire or backyard lounge sessions so much more enjoyable.,4.3,https://www.rei.com/media/306892f9-e30e-4492-bbf9-e7748fbf65f1?size=784x588,"['X-Web technology uses X-shape webbing to tension the seat and back panel, and distribute your weight for excellent sitting comfort', 'Mono-mesh and polyester seating surface stands up to regular use and exposure to weather; mesh fabric drains water and dries quickly', 'Frame is constructed of heavy-duty, thick-walled steel tubing for enduring strength; powder coating keeps the frame looking nice for years of use', 'Versatile integrated cup holder on the right armrest accommodates a wide variety of container shapes and sizes, from mugs to plastic bottles to long-neck glass bottles', 'Drop-down pocket on the left armrest holds your cell phone and other small valuables; cinch the pocket closed with the string and cordlock to keep items from falling out', 'Chair has a weight capacity of 300 lbs.', 'The REI Camp X chair packs up into the included stuff sack for easy storage and transportation']"
GCI Outdoor Kickback Rocker Chair,GCI Outdoor,$65.00,"Supplying copious comfort for its midsize stature, the light and compact GCI Outdoor Kickback Rocker chair sits slightly lower than standard chairs, but higher than low-to-the-ground designs.",4.6,https://www.rei.com/media/42ee18df-a88c-4100-a4b6-7d65d0744ad5?size=784x588,"['Patented Spring-Action Rocking Technology™ ensures smooth rocking action on flat, hard or soft terrain', 'Features a built-in carry strap and loop-and-peg closure system for quick setup and takedown', 'Includes a beverage holder and phone pocket', 'Powder-coated steel frame is strong and durable']"
Mountain Summit Gear Cooler Chair,Mountain Summit Gear,$36.93,"The ultimate tailgater's base camp, the Mountain Summit Gear Cooler chair comes with a detachable, insulated cooler and a folding table, making it perfect for the big game, backyard or campsite.",4.4,https://www.rei.com/media/a4c95047-905e-4d65-8d2f-fdc285872008?size=784x588,"['Ergonomic design and padded armrests add comfort', 'Detachable, insulated cooler keeps your drinks chilled', 'Large folding side table lets you set up all your snacks', 'Steel frame with a powder-coated finish provides durability']"
REI Co-op Flexlite Air Chair,REI Co-op,$99.95,"The REI Co-op Flexlite Air is one chair even ounce-counting backpackers can love—for just one extra pound, you get the luxury of sitting high and dry, out of the reach of poking pine needles.",4.1,https://www.rei.com/media/6ab9893b-3da2-42a9-92e2-060250f5340d?size=784x588,"[""Sets up easily using an aluminum frame that's similar to the frame on a lightweight tent; 4-leg design provides stability"", 'Sturdy ripstop nylon seat has a durable water repellent (DWR) finish to shed light rain and stains', 'Folds down easily to store in the included stuff sack', '250 lb. weight capacity']"
REI Co-op Flexlite Camp Chair,REI Co-op,$69.95,"For both its size and hardiness, the REI Co-op Flexlite camp chair has become a co-op favorite. Its ripstop seat and tentlike frame surpass our durability tests—and fans' bring-it-anywhere tests, too.",4.1,https://www.rei.com/media/85a3df6c-ba55-4dc8-87ea-aabcc8ac4e02?size=784x588,"['Updated seat eliminates tension zones and provides comfort for a wider range of bodies; updated pole pockets utilize pull loops and larger openings for an easier setup', ""Sets up easily using an aluminum frame that's similar to the frame on a lightweight tent; 4-leg design provides stability"", 'Abrasion-resistant ripstop polyester seat also has a Durable Water Repellent (DWR) finish to resist moisture and stains', 'Folds down easily to store in the included stuff sack', 'Made to reflect our love for people and the planet through the use of bluesign®-approved polyester', 'bluesign®-approved materials conserve resources and protect the health of the environment, workers and wearer (you!)']"
REI Co-op Outward Padded Bench,REI Co-op,$49.93,We made this easy-to-tote 2-person bench with a padded seat to ensure everybody has a comfy spot at your campfire. The REI Co-op Outward Padded Bench packs down small and opens up in a flash.,4.9,https://www.rei.com/media/fbe44ec7-0ecc-44a9-9934-6e3b3448229b?size=784x588,"['Seat is made from sturdy ripstop polyester with a durable water repellent (DWR) to shed light rain and stains', 'Foam padding provides comfort and warmth', 'Coated aluminum frame with steel bracing is light but strong and solidly supportive', 'Bench folds down to 24.5 x 18 x 8 in. for easy transport', 'Weight capacity: 500 lbs.', 'Made using bluesign®-approved materials, which conserve resources and protect the health of the environment, workers and sitter (you!)']"
REI Co-op Camp Low Chair,REI Co-op,$49.95,"Making a comeback because of co-op love, the REI Co-op Camp Low chair is beloved for its low-profile, durable powder-coated steel frame, comfy, water-repellent padded seat and overall carry-ability.",4.3,https://www.rei.com/media/1ef27b5f-5324-46db-8be3-7adf244f60bd?size=784x588,"['Low-profile padded seat provides off-ground comfort at an outdoor concert, sandy beach or campsite', 'Chair folds down flat and comes with an adjustable, clip-off carry strap for easy transport', 'Rugged powder-coated steel frame stays strong and looking nice for years of use', 'Rear pocket stows small essentials', 'Made to reflect our love for people and the planet through the use of recycled polyester and bluesign®-approved materials', 'Recycled materials keep waste out of landfills and bluesign®-approved materials conserve resources and protect the health of the environment, workers and user (you!)']"
REI Co-op Camp Xtra Chair,REI Co-op,$69.95,"Sturdy, comfortable and stocked with 2 drink holders and a side stash pocket, this chair features X-Web technology to evenly distribute your weight and make the most of your lounge time.",4.5,https://www.rei.com/media/34209956-4bfd-4402-8ad0-2da7ce9cf5be?size=784x588,"['X-Web technology uses X-shaped webbing to tension the seat and back panel, and distribute your weight for excellent sitting comfort', 'Double-layer 600-denier polyester ripstop fabric ensures years of use; close-cell foam padding in the seat adds comfort', 'Frame is constructed of heavy-duty, thick-walled steel tubing for enduring strength; powder coating keeps the frame looking nice for years of use', 'Versatile integrated cup holders on both armrests accommodate a wide variety of container shapes and sizes, from mugs to plastic bottles to long-neck glass bottles', 'Side stash pocket keeps magazines, books and maps within reach', 'Chair has a weight capacity of 400 lbs.', 'The REI Camp Xtra chair packs up into the included stuff sack for easy storage and transport']"
Mountain Summit Gear Ultra Comfort Camp Chair,Mountain Summit Gear,$36.93,"Comfortable and stable with an updated ergonomic design, the Mountain Summit Gear Ultra Comfort camp chair is compact enough take along on camping trips, sporting adventures and more.",4.5,https://www.rei.com/media/e9eee2e1-b903-4b5b-a275-5c0bd8b467f1?size=784x588,"['Durable ripstop material and fine mesh construction holds up and lets air flow through', 'Frame design stays closed without straps for easy transport', 'Includes a carry bag with strap for transport and storage']"
REI Co-op Camp Prep Table,REI Co-op,$149.00,Never enough prep space? Carry along the REI Co-op Camp Prep Table to extend your tailgate or picnic table. The independently adjustable legs handle a wide range of heights and uneven terrain.,4.3,https://www.rei.com/media/78984a3f-828d-4e5c-80bc-f99bf018fd88?size=784x588,"['Powder-coated aluminum slat top is durable, lightweight, heat-resistant and easy to clean', 'Steel legs independently adjust from 22 to 31 in. using lever locks similar to those on trekking poles', 'Corner holes let you DIY some hanging storage, like a trash bag loop or dish towel hanger', 'Folds in half for compact storage; handle makes for easy transportation', '100 lb. weight capacity']"
REI Co-op Trail Stool,REI Co-op,$24.95,"Get off the ground and up onto the comfortable, travel-friendly Trail Stool. It's light enough to take on short hikes and sturdy enough for regular use at the campground.",4.3,https://www.rei.com/media/25a795b2-af55-427a-b1dc-5e703ec4dd8b?size=784x588,['Rugged aluminum legs maximize load capacity and minimize weight and bulkiness']
Helinox Chair Zero,Helinox,$129.95,"The Helinox Chair Zero is a lightweight and comfortable, four-legged camp chair that packs down to the width of a standard 32 oz. water bottle and weighs just a single pound.",4.5,https://www.rei.com/media/dc47d9eb-d3d8-4c1f-93e9-9e8a33d70f84?size=784x588,"['Seat is 8.5 in. off the ground', 'Thanks to anodized DAC aluminum poles, Chair Zero is strong enough to support up to 265 lbs.', 'Single shockcorded pole structure makes for easy setup', 'Compact size makes it easy to pack and carry', 'Stuff sack included', 'To sit above snow, sand, or muddy ground, pair it with the small Helinox Chair Groundsheet (not included), which secures to the feet and distributes weight to a larger surface']"
Mountain Summit Gear Horizon Cot,Mountain Summit Gear,$99.95,"Spend less time setting up camp and more time lounging under the stars with this Mountain Summit Gear Horizon cot. Setup is as easy as 1, 2, 3.",4.4,https://www.rei.com/media/a2d749b0-5e79-4696-9f8e-ba90b951f0d2?size=784x588,"['Easy-fold frame system offers quick setup', '600-denier polyester fabric is comfortable and durable', 'Sturdy steel frame', 'Excellent for camping or lounging, this cot also makes a great extra bed for home use', 'Side pocket offers convenient storage', '300 lb. (136 kg) weight capacity']"
NEMO Stargaze Recliner Luxury Chair,NEMO,$249.95,"Be the hit of the meteor shower party in the NEMO Stargaze Recliner Luxury. Its supportive headrest ensures you won't get a crick in your neck as you lean back, swing and marvel at the night sky.",4.3,https://www.rei.com/media/3cb634bf-c2d0-436e-af34-a4e9b57b4c09?size=784x588,"['Suspended air-rocking and reclining chair swings smoothly and gently on any surface, including above rocky or sandy surfaces', 'Auto-reclining hardware lets you lean back and stretch out without the use of runners', 'Aircraft-grade aluminum suspension frame is sturdy and packs down quickly and compactly', 'Water-resistant mesh resists the buildup of odor-causing bacteria and stands up to sun exposure', 'Padded armrests are comfortable for lounging in the backyard or at the campsite', 'Chair swings smoothly and gently, with a relaxing motion that is designed for comfort', ""Integrated cup holder keeps a beverage within arm's reach"", 'Stash pocket accommodates a tablet, keys or a favorite book', 'Padded carrying case has a convenient interior storage pocket']"
REI Co-op Flexlite Camp Dreamer Chair,REI Co-op,$99.95,"You asked for it: a headrest on our durable, compact co-op favorite Flexlite chair. The REI Co-op Flexlite Camp Dreamer has it, plus sizable pockets to truly make this a dream of a chair.",4.1,https://www.rei.com/media/eb7f93b1-5201-4a1d-8dc0-928e779f2171?size=784x588,"['Removable pillow, higher back, mesh pockets on both sides and an increased weight limit of 300 lbs. make this a comfort-first upgrade from the original Flexlite camp chair', 'Updated seat eliminates tension zones and provides comfort for a wider range of bodies; updated pole pockets utilize pull loops and larger openings for an easier setup', ""Sets up easily using an aluminum frame that's similar to the frame on a lightweight tent; 4-leg design provides stability"", 'Abrasion-resistant ripstop polyester seat also has a Durable Water Repellent (DWR) finish to resist moisture and stains', 'Folds down easily to store in the included stuff sack', 'Made to reflect our love for people and the planet through the use of bluesign®-approved polyester', 'bluesign®-approved materials conserve resources and protect the health of the environment, workers and wearer (you!)']"
REI Co-op Campwell Picnic Bench Covers,REI Co-op,$44.95,"What? That splintery, dirty picnic table bench doesn't look inviting? Lay down the padded REI Co-op Campwell picnic bench covers and make every seat at the table a happy one.",4.5,https://www.rei.com/media/1cb1cdc1-f69d-4cca-919a-dbc3ca310986?size=784x588,"['Rugged, 200-denier recycled polyester fabric has a durable water repellent coating (DWR) to repel moisture and wipe clean easily', 'Foam padded for comfort', 'Adjustable retention straps secure covers to benches', 'Set of 2 covers both sides of standard-size picnic table benches', 'Includes stuff sack', 'Hand-wash, line dry', 'Made to reflect our love for people and the planet through the use of recycled polyester and bluesign®-approved materials', 'Recycled materials keep waste out of landfills and bluesign®-approved materials conserve resources and protect the health of the environment, workers and wearer (you!)']"
REI Co-op + West Elm Outward Dining Table,REI Co-op + West Elm,$149.00,"Whether you're in for a feast or just laying out snacks, the REI Co-op + West Elm Outward Dining Table will come in handy. It has a heat-resistant top that rolls up when it's time to break camp.",3.8,https://www.rei.com/media/ce0f6d34-194a-4b36-85c9-39e907072146?size=784x588,"['Heat-resistant aluminum roll-top provides a large, stable surface for meals, games and prep', 'Durable powder-coated steel frame is lightweight yet sturdy', 'Foldable frame and roll-up slats easily stow into the included carry bag']"
Mountain Summit Gear Deluxe Roll Top Kitchen,Mountain Summit Gear,$149.95,Store all of your camp kitchen goodies with the spacious Mountain Summit Gear Deluxe Roll Top kitchen. It has 2 side tables and a detachable compartment with two shelves to keep your gear organized.,4.6,https://www.rei.com/media/058e7a8a-a85e-4632-8027-84d479d78b88?size=784x588,"['Lightweight, sturdy, weather-resistant aluminum frame sets up in under a minute', '2 aluminum roll-top table stations and 2 foldaway side tables', 'Detachable storage compartment with 2 shelves', 'Adjustable legs accommodate uneven surfaces', 'Folds and stores away in a convenient, easy-to-carry bag']"
REI Co-op Kingdom Cot 3,REI Co-op,$199.00,"Anything but your typical bare-bones cot, the fully padded REI Kingdom Cot 3 provides plush support with plenty of room to stretch out, relax and slumber until the sun comes up.",4.3,https://www.rei.com/media/e8cbcfed-b161-481b-91b3-128e17b0bc9c?size=784x588,"['Aluminum / steel tubing delivers superb strength; rugged powder-coated frame holds up to years of use', 'Plushly padded, quilted top is made from quick-drying, water-resistant polyester fabric', 'Oversized feet accommodate uneven ground and are designed for use inside a tent', '3 sets of legs provide excellent support and strength to hold up to 300 lbs.', 'Twist knob sets multiposition back', 'Folding frame packs up small for convenient storage and travel']"
REI Co-op Flexlite Camp Boss Chair,REI Co-op,$89.95,"20% larger than the Flexlite that started it all, the REI Co-op Flexlite Camp Boss has a wider seat and heftier frame that might anoint you head of camp. Just remember to delegate.",4.5,https://www.rei.com/media/99c97a89-786f-4023-aece-72562eb2b1dc?size=784x588,"['20% larger in all dimensions than the original Flexlite Chair; increased weight capacity of 300 lbs. (compared to 250 lbs. for the original Flexlite)', 'Updated seat eliminates tension zones and provides comfort for a wider range of bodies; updated pole pockets utilize pull loops and larger openings for an easier setup', ""Sets up easily using an aluminum frame that's similar to the frame on a lightweight tent; 4-leg design provides stability"", 'Abrasion-resistant ripstop polyester seat also has a Durable Water Repellent (DWR) finish to resist moisture and stains', 'Folds down easily to store in the included stuff sack', 'Made to reflect our love for people and the planet through the use of bluesign®-approved polyester', 'bluesign®-approved materials conserve resources and protect the health of the environment, workers and wearer (you!)']"
REI Co-op Camp Roll Table,REI Co-op,$79.95,"Whether you're playing cards or sitting down for a gourmet dinner, this lightweight, packable table makes it all possible on your car-camping adventures.",4.5,https://www.rei.com/media/02699e6a-cc9e-49ac-a89d-5ffbf77a3982?size=784x588,"['Aluminum legs and heat-resistant aluminum slat top provide a stable, rigid work surface and dining area; aluminum construction saves on weight', 'Roll top design packs up small, yet provides plenty of space for pots, pans and plates', 'Packs up into the stuff sack that is included for easy storage and transportation', 'REI Camp Roll Table has a weight capacity of 100 lbs.']"
NEMO Moonlite Reclining Camp Chair,NEMO,$149.95,"Easy to set up and barely noticeable in your pack, the NEMO Moonlite reclining camp chair is a go-to for every adventure from backyard barbecues and picnics in the park to camping in the mountains.",4.6,https://www.rei.com/media/768fc5a4-11be-46d6-8748-a98f34391717?size=784x588,"['Multiposition reclining system allows you to lean forward or kick back and relax', 'An inclusive seat height and extremely durable frame makes the Moonlite comfortable, supportive and easy to get in and out of for folks of all sizes', 'Seamless seat construction is made possible by custom engineered mesh that conforms to your body when you sit', 'Intuitive design makes assembly a breeze with shockcord throughout the frame and ball-and-socket snap connectors', 'High-quality, well-fitting hardware builds confidence and offers a sleek aesthetic', 'Premium forged 6061 aluminum hubs and tubular 7001 aluminum frame are refined, lightweight and sturdy', 'Circular and oval tubular aluminum poles offer a just-right blend of rigidity and flexibility for rock solid support', '100% postconsumer recycled materials are used to build asymmetric mesh, edge binding, webbing and ball-and-socket connection panels', 'Includes a compact carrying case', 'Protected by the NEMO lifetime warranty']"
YETI Trailhead Camp Chair,YETI,$300.00,"Designed for durability and amazing comfort, the YETI Trailhead Camp Chair has hands-free portability and a lightweight folding frame that make it easy to pack up, carry and load in your vehicle.",4.7,https://www.rei.com/media/6bbbfeba-eb34-44d3-98ed-17883e983183?size=784x588,"[""Supportive, UV-rated FlexGrid™ fabric is comfortable when you're taking a load off"", 'PackAway frame with Lockdown™ comfort and Groundgrip™ feet', 'Adjustable cup holder', 'Comes with a handy carry bag']"
Kelty Low Loveseat,Kelty,$139.95,"Cuddle up with your partner or best pal in the Kelty Low loveseat. Its relaxed, low-profile, reclined design means you won't be towering over the campfire or blocking anyone's view of the stage.",4.7,https://www.rei.com/media/985fe6c3-c36e-45ed-b2a4-3d86acff75c4?size=784x588,"['Durable steel frame construction with adjustable armrests', '2 insulated, adjustable holders stash your beverages of choice', 'Includes a padded roll-tote storage bag for take-anywhere convenience']"
Lafuma R Clip Reclining Chair,Lafuma,$158.99,"Offering a variety of angles—including a zero-gravity position to relieve your back, soothe your breathing and improve circulation—this Lafuma R Clip reclining chair is a seriously comfortable seat.",5.0,https://www.rei.com/media/9893bc98-19d3-4534-b8e8-324be3a24a2e?size=784x588,"['Chair reclines to multiple seating angles, including zero gravity, the position that the body naturally takes when weightless, with the leg and torso forming an angle of 127°', 'Zero gravity angle improves circulation and breathing, makes legs feel lighter, and relieves pressure on the back', 'Removable canvas fastens by patented elastomer clips; clips help better distribute body weight, provide back support and improve comfort and firmness compared to elastic laces', 'Batyline® fabric has high resistance to rot, mildew, UV radiation and fading', 'Chair folds compactly for storage or travel', '5-year warranty offered by the manufacturer']"
ENO DoubleNest Hammock,ENO,$52.39,"Spacious enough for two people, the ENO DoubleNest hammock gives you an all-access pass to relaxation. It's expertly constructed with durable yet soft FreeWave™ fabric and packs up small.",4.6,https://www.rei.com/media/c51a7224-ebb7-40fc-a6a0-b6086c82100d?size=784x588,"['Updated with supremely comfortable, breathable and fast-drying FreeWave fabric', 'Made with exclusive crinkle treatment for exceptional softness and packability', 'Extended 9.5 ft. hammock body creates more room to stretch out, lie flat and relax', 'Time-tested, triple-stitched seam construction creates unmatched durability and protection against ripping or tearing', 'Refreshed hardware includes a custom side-release buckle and larger cordlock for easy setup and pack-up every time', 'Integrated stuff sack compresses the hammock to a travel-ready size and now offers a bonus internal stash pocket to store a phone or drink', 'Weighing in at just 1 lb. 3 oz., the DoubleNest packs down to the size of a grapefruit and is light enough to take anywhere', 'Specially designed carabiners easily attach to all ENO hammock straps or other secure anchor points and help maintain correct orientation for an easier hang', 'Straps and suspension system not included', 'Compatible with all ENO hammock straps, stands, bug nets, rain tarps and insulation systems (not included)', 'ENO plants 2 trees for every hammock purchase through their partnership with Trees for the Future', 'ENO is a member of the 1% For The Planet organization, donating 1% of sales to environmental nonprofits']"
REI Co-op Flexlite Print Camp Boss Chair,REI Co-op,$89.95,"20% larger—and 100% more printed—than the Flexlite that started it all, the REI Co-op Flexlite Print Camp Boss has a wider seat and heftier frame that might anoint you head of camp.",4.7,https://www.rei.com/media/d06c235d-e30a-426f-8ebe-21edae083b33?size=784x588,"['20% larger in all dimensions than the original Flexlite Chair; increased weight capacity of 300 lbs. (compared to 250 lbs. for the original Flexlite)', 'Updated seat eliminates tension zones and provides comfort for a wider range of bodies; updated pole pockets utilize pull loops and larger openings for an easier setup', ""Sets up easily using an aluminum frame that's similar to the frame on a lightweight tent; 4-leg design provides stability"", 'Abrasion-resistant ripstop polyester seat also has a Durable Water Repellent (DWR) finish to resist moisture and stains', 'Folds down easily to store in the included stuff sack', 'Made to reflect our love for people and the planet through the use of bluesign®-approved polyester', 'bluesign®-approved materials conserve resources and protect the health of the environment, workers and wearer (you!)']"
Helinox Lite Cot,Helinox,$279.95,"Drift off to dreamland on the Helinox Lite Cot. Packing smaller and lighter than a pair of hiking boots, it keeps your tired bones off the cold, hard ground without adding much weight to your gear.",4.3,https://www.rei.com/media/ed7e52a9-10f0-481e-8282-4d19e2e832ea?size=784x588,"['Weighs just 2 lbs. 13 oz. and packs down to a compact size of 5 x 21 in.', 'Proprietary aluminum alloy legs and frame ensure strength with minimum weight; cot supports up to 265 lbs.', 'Pressure-fit legs add to the weight savings without skimping on comfort', 'Cot cover and zippered carrying case are made from durable, 600-weave ripstop polyester', 'Setup is easy and fast with a single internal bungee cord that self-assembles the poles']"
GCI Outdoor RoadTrip Rocker Chair,GCI Outdoor,$90.00,"Combining the comfort and innovation of the Freestyle Rocker with the portable convenience of a bag chair, the GCI Outdoor RoadTrip Rocker chair is a serious game changer.",4.6,https://www.rei.com/media/f48b36f0-0951-4307-8abf-e525f088ea5e?size=784x588,"['Full-size rocker easily folds up to fit inside the included carry bag', 'Spring Action Rocking Technology™ provides smooth rocking while you enjoy your time in the outdoors', 'Mesh backrest is comfortable and breathable', 'Powder-coated steel frame', 'New, deeper seat', 'Ergonomic plastic armrests', 'Beverage holder', ""Covered by manufacturer's limited lifetime warranty""]"
