title,brand,price,description,rating,image,feature
Zamberlan Vioz Lux GTX RR Hiking Boots - Women's,Zamberlan,$390.00,"Handcrafted in Italy, the exceptionally comfortable yet extra rugged Zamberlan Vioz Lux GTX RR waterproof breathable backpacking boots are made for 4-season backcountry use with or without a pack.",4.8,https://www.rei.com/media/9ae05df4-f22e-479b-9184-48ecacb8ce35?size=784x588,"['Women-specific construction around the Zamberlan Backpacking Last (ZBPK) for excellent heel lock, an anatomic wrap around the top of the foot and a roomy toe box for comfort', 'Waxed Tuscan leather uppers with rubber toe rands and calf leather-lined collars hold up to hard use on the trail', 'Uppers are treated with proprietary Hydrobloc technology to ensure the leathers stay supple and strong', 'Gore-Tex® Performance Comfort membranes offer waterproof breathable protection and durability', 'ZFS (Zamberlan Flex System) allows the boot to comfortably flex forward without compromising lateral support', 'Dual-density polyurethane midsoles offer the right mix of cushion, lightweight performance and durability', 'Robust polypropylene midsole shank offers excellent support and assistance for steep terrain when carrying heavy loads', 'Vibram 3D outsoles have wide lugs for easy debris removal, and a forward rocker for enhanced mobility uphill and excellent downhill braking capability', 'Treated hardware extends life without corrosion, adds durability against rocks and debris, and lets laces pass easily through to prevent breakage', 'Includes 2 sets of laces: one flat and one round', ""To have your boots resoled with original and exclusive Vibram 3D outsoles, visit Zamberlan's website to learn more and connect with one of their approved cobblers""]"
Arc'teryx Konseal FL 2 Leather Approach Shoes - Women's,Arc'teryx,$190.00,"On technical approaches with a loaded pack, the women's Arc'teryx Konseal FL 2 Leather approach shoes balance stiffness and flex to move you forward with sure-footed confidence.",0.0,https://www.rei.com/media/73a33328-afd0-4155-8d9d-68727b6fe318?size=784x588,"['Fast and light design is nimble and supportive for technical trails and hikes; minimalist look moves easily from trail to town', 'Durable split-suede leather uppers are PFC-free and breathable', 'Gusseted tongues help minimize debris collection', '3D-molded Ion Element midsoles are made with 100% recycled closed-cell EVA by Dynamic Foam (4.5 mm) for lasting cushion and comfort', 'TPU midfoot chassis and raised perimeter sidewalls provide stability on shifting surfaces', '0.8 mm microfiber heel linings add comfort', '3D-molded rubber toe caps provide protection and increase durability', 'Protective oil randing', 'Durable and grippy Vibram® Megagrip outsoles provide a secure hold in wet or dry conditions']"
Topo Athletic Trailventure 2 Hiking Boots - Women's,Topo Athletic,$160.00,"Make every trail your own with the women's Topo Athletic Trailventure 2 hiking boots. They offer roomy toe boxes and a lightweight, durable and comfortable ride on technical terrain.",4.5,https://www.rei.com/media/603b6b33-9975-479a-b632-a4698e69248a?size=784x588,"['Durable mesh uppers offer increased breathability with a secure fit, while medial drainage ports allow for water release and quick drying', 'Antimicrobial OrthoLite® insoles offer additional comfort underfoot and inhibit the growth of odor-causing bacteria on the footwear', '33 x 28 mm cushioned platforms feature ZipFoam™ midsoles for an even more stable and comfortable experience underfoot', 'External TPU heel counters provide heel support and keep your feet secure over the cushioned platform', 'Vibram® XS Trek EVO outsoles offer optimal multisurface traction and durability on all terrain', 'Compatible with Topo Athletic Performance Gaiters (not included)']"
KEEN Targhee High Lace Waterproof Boots - Men's,KEEN,$189.95,"Winter is no match for KEEN Targhee High Lace men's boots. They have the fit, durability and performance of Targhee hiking boots along with insulation, cold-weather traction and a taller profile.",4.6,https://www.rei.com/media/788e3f8d-f2b9-4db8-9570-fad90ff108b0?size=784x588,"['Waterproof, salt-resistant leather uppers with KEEN.DRY waterproof, breathable membranes supply protection from wet weather', 'Lightweight KEEN.WARM insulation is temperature rated to -25°F (-32°C)', 'Speed hooks allow easy lace adjustment', 'Removable, dual-density EVA footbeds and dual-density, compression-molded EVA midsoles supply cushioning', 'ESS shank adds stability', 'Cleansport® NXT technology offers natural odor control', 'Nonmarking KEEN.FREEZE rubber outsoles deliver cold-weather traction; 4mm multidirectional lugs aid grip']"
Salomon OUTpulse GORE-TEX Low Hiking Shoes - Men's,Salomon,$140.00,"Ready to propel you forward on your outdoor exploits, the men's Salomon OUTpulse GORE-TEX Low hiking shoes mix protective grip with energy return, cushioning and shelter from the elements.",4.7,https://www.rei.com/media/d4e528d1-376c-43fb-a164-dc94843e0249?size=784x588,"['GORE-TEX waterproof/breathable membranes shield your feet from wet weather', ""Inspired by the brand's ski heritage, the reverse camber curved midsole geometry provides a floaty, fluid feel with each step"", 'Full rubber toe caps offer protection from roots and rocks', 'Fuze Surge foam compound delivers premium energy return and cushioning', 'Engineered into the forefoot area of the bottom unit, the Energy Blade TPU plate helps deliver a smooth, dynamic stride', 'Contagrip® rubber outsoles provide sure grip in unpredictable conditions']"
Danner Inquire Chukka Boots - Women's,Danner,$169.95,"For days that begin with walking the dog in town and end with a sunset hike, the women's Danner Inquire Chukka boots are built to handle it all while remaining light and supportive underfoot.",4.5,https://www.rei.com/media/4a3cf2b9-1992-4222-9f3d-41999f391f47?size=784x588,"['Modern construction and design elements create a streamlined shape, while classic aesthetics and functional durability stay rooted in the Danner hiking heritage', 'Lightweight, durable suede uppers are backed by Danner® Dry waterproof protection', 'Open-cell OrthoLite® footbeds and Plyolite™ EVA midsoles offer cushioning and rebound', 'Lightweight Trailguard platforms with thermoplastic urethane (TPU) shanks provide stability, support and comfort', 'Custom Vibram® Megagrip outsoles have multidirectional lugs and adaptive heels for grip on wet or dry surfaces', 'Danner indicates these boots fit true to size']"
Danner Trail 2650 Campo Hiking Shoes - Men's,Danner,$179.95,"Made for warm-weather hiking, the men's Danner Trail 2650 Campo shoes are comfortable as running shoes, but built tough for scrambling over rocky terrain or trekking through sand and sagebrush.",4.0,https://www.rei.com/media/6d7d3109-5a1c-4bc5-97b5-9045ea05d95e?size=784x588,"['Inspired by the hot, dusty stretches of the Pacific Crest Trail, which originates in the southern California desert', 'Lightweight and breathable uppers provide total foot comfort; open mesh has additional perforations for extra airflow', 'Compatible with dust gaiters (not included) so you can move confidently through desert terrain', 'EXO Heel System provides maximum support and comfort with reinforced external heel counters', 'Cushioning open-cell OrthoLite® footbeds', 'TRAILGUARD platforms with exposed TPU shanks offer lightweight, athletic performance', 'Danner® PlyoGo lightweight, shock-absorbing EVA midsoles', 'Vibram® 460 outsoles with Megagrip technology offer superior grip on wet and dry surfaces', 'Danner indicates these shoes fit true to size']"
Salomon X Ultra Pioneer Aero Hiking Shoes - Women's,Salomon,$110.00,"Rocks, roots, mud and views calling your name? Answer the call in comfort with the grippy women's Salomon X Ultra Pioneer Aero hiking shoes. They're packed with everything you need for a good time.",0.0,https://www.rei.com/media/494de1ce-a724-4158-b7c4-9cba202318f6?size=784x588,"['Close-to-foot Sensifit™ design cradles your feet for a precise and comfortable fit that minimizes foot slippage inside the shoes', 'Advanced Chassis™ between the outsole and midsole maximizes motion control and protection for a stable, efficient ride', 'Foam cushioning adds a plush feel underfoot', '2 types of rubber and a patterned heel area grab the ground, giving you more control in muddy conditions', 'Traditional lacing system with eyelets']"
AKU Alterra GTX Hiking Boots - Men's,AKU,$279.95,"Lauded by Backpacker mag for needing minimal break-in time, the AKU Alterra GTX men's hiking boots are agile yet rugged, designed for enhanced comfort and stride performance over mixed terrain.",4.6,https://www.rei.com/media/d4002edb-96e6-4683-9fa3-e19bfea887ce?size=784x588,"['GORE-TEX® waterproof breathable membranes let feet breathe while protecting them from wet weather, keeping them dry and comfortable', ""AKU's Elica Fit technology allows your feet to move through their natural range of motion, providing enhanced comfort and reduced fatigue and foot strain"", 'Fit follows the anatomic shape of the sole of your foot, allowing normal heel and forefoot positioning for comfort and control', 'Gusseted tongues keep out trail debris and use soft materials to provide a smooth transition across your insteps for all-day comfort', 'Collars offer a gaiterlike cuff for a snug fit that keeps pebbles, debris and drizzle out', 'Integrated rubber toe caps provide durable protection from roots and rocks', 'Engineered eyelets have tiny rotating pulleys that allow quick adjustments and equalize pressure from top to toe with a single pull', 'IMS3 chassis combined with polyurethane exoskeletons and midsoles support your feet, help control flex, reduce ankle strain, enhance stability and protect from rough terrain', 'IMS custom-fit footbeds provide shock absorption and comfort', 'Vibram® rubber outsoles supply excellent grip and traction for stability underfoot in both wet and dry conditions', 'Comes with 2 sets of laces: Red and Gray', 'Handmade in Europe', 'Awarded Best Fit from Backpacker Magazine in 2017; fits true to size']"
Merrell Moab 3 Waterproof Hiking Shoes - Men's,Merrell,$135.00,"Wet out? No bother. Go farther with the men's Merrell Moab 3 Waterproof hiking shoes. Known for comfort, durability and versatility, the latest iteration is softer, grippier and more supportive.",4.8,https://www.rei.com/media/bc285393-78d8-4a88-9830-f1feec452d74?size=784x588,"['Updated from their Moab 2 predecessors with partially recycled fabrics, more supportive insoles, more cushioned midsoles and grippier Vibram® outsoles', 'Pigskin leather and mesh uppers have protective rubber toe caps and bellows tongues to keep out moisture and debris', 'Waterproof membranes seal out water and let moisture escape', 'Removable Kinetic Fit™ Advanced contoured insoles with reinforced heel cushioning provide medium support', 'Super Rebound Compound delivers durable shock absorption in the heels to help reduce torque and allow for a smooth transition to the midfoot', 'Merrell Air Cushion in the heels absorbs shock and adds stability', 'Molded nylon arch shanks add torsional rigidity on rough terrain', 'Vibram TC5+ nonmarking outsoles with 5 mm lugs balance grip and traction with durability and flexibility; technical compound offers great multisport performance', 'Mesh lining, laces and webbing are made with 100% recycled materials']"
