title,brand,price,description,rating,image,feature
Merrell Moab 2 Mid Ventilator Hiking Boots - Men's,Merrell,$83.93,"Moab stands for Mother-Of-All-Boots. Experience out-of-the-box comfort in the ventilated Merrell Moab 2 Ventilator Mid men's hikers with their durable leather, supportive footbeds and Vibram traction.",4.6,https://www.rei.com/media/d4512d61-d665-4aa7-bddb-613756e0e7f9?size=784x588,"['Performance suede leather and mesh uppers have protective rubber toe caps; breathable mesh lining', 'Bellowed, closed-cell foam tongues keep moisture and debris out', 'Merrell M Select Fit.Eco+ blended-EVA, contoured footbeds with zonal arch and heel support', 'Merrell air cushion in the heels absorbs shock and adds stability', 'EVA midsoles for stability and comfort', 'Molded nylon arch shank adds stability', 'Vibram TC5+ outsoles have a 5mm lug depth for grip']"
Salomon X Ultra 3 Mid GTX Hiking Boots - Women's,Salomon,$122.93,"Salomon X Ultra 3 Mid GTX womens hiking boots bring running-shoe comfort to technical hikes. Design updates make them especially suited for tackling tough descents, even in wet conditions.",4.2,https://www.rei.com/media/088ad8d6-7dc2-496d-a446-682713c48da0?size=784x588,"['Polyurethane-coated leather uppers with GORE-TEX® waterproof/breathable liners are ready to take on wet weather and muddy trails', ""Contoured to fit women's feet, abrasion-resistant linings provide great breathability and quick drying"", 'Precise and secure fit cradles the feet', 'Mid-cut profile adds ankle support and protection for all-day comfort on the trail', 'Gussets create a continuous connection between the tongues and uppers, sealing out debris and providing a smooth transition across the instep area for all-day comfort', 'Mud guards and integrated rubber toe caps provide durable protection from roots and rocks', 'Maximized stability and motion control deliver an efficient, responsive ride without excess weight', 'Injected EVA midsoles provide cushioning and anatomically designed support', 'OrthoLite® sockliners combine a specific OrthoLite foam and contoured EVA heel cups to enhance heel support and cushioning', 'Contagrip® rubber outsoles provide dependable traction']"
La Sportiva Nucleo High II GTX Hiking Boots - Men's,La Sportiva,$229.00,"Lightweight and super-comfortable, La Sportiva Nucleo High II GTX boots with GORE-TEX® SURROUND™ tech combine durability, breathability and waterproof protection to keep you trekking all day long.",4.1,https://www.rei.com/media/abfd0fb9-5e89-47e0-a607-7ae8f4103240?size=784x588,"['Durable nubuck leather uppers provide protection while the integrated Nano-Cell™ technology delivers maximum breathability to keep your feet cool', 'Nano-Cell™ technology works with the GORE-TEX SURROUND waterproof membranes to enable unprecedented breathability underfoot', 'Compression-molded midsoles provide superior cushion and support and a noticeable bounce in every stride, for all-day comfort', 'Vibram® Nano outsoles with Impact Brake System™ provide maximum traction and grip on trails', 'Available in Regular and Wide sizes to accommodate a broader variety of foot sizes and shapes']"
REI Co-op Flash Hiking Boots - Men's,REI Co-op,$150.00,"Fly over trails in the waterproof, breathable men's REI Co-op Flash hiking boots. REI-exclusive technologies create fast-and-light boots—with a lighter footprint—that are comfy right out of the box.",4.0,https://www.rei.com/media/4dbe88ce-6809-42a5-8b33-3343adfa1233?size=784x588,"['Strong and socklike FirmaKnit™ uppers are made from 99% recycled PET polyester and are designed for lightweight yet durable comfort right out of the box', ""HydroWall™ complete waterproof/breathable protection keeps your feet dry when the trail ahead isn't—and uses 75% recycled polyester to do so"", '20% recycled rubber TerraGrip™ tread provides anti-slip grip on all kinds of terrain with 4 mm forefoot climbing lugs for going up and 4 mm heel braking lugs for coming down', 'TerraLoft™ midsoles use 10% algae-based BLOOM™ foam to cradle your feet with a cushioning system that feels like your favorite trail-running shoes (soft, but not too soft)', ""TrailBed™ insoles use Insite® Contoura® technology created with podiatrists to ensure support and comfort; plus, it's made with 25% USDA-certified bio-based Susterra® compound"", ""2-layer 30% recycled TPU overlays are designed to create durable and supportive uppers—the structure you need for long hours on the trail that's still light and minimalist"", 'Molded nylon midfoot shanks provide lightweight support to protect your feet from the trail and help propel you forward', 'Recycled PET polyester webbing and lacing creates a midfoot cradle system that allows for a highly adjustable and locked-down fit', 'Extra space in the toe boxes allows for natural changes in your feet (like swelling) during hours of trail exploration', 'Informed by feedback from over 6,000 people and field tested by 100 co-op members over 2,000 hours and 700+ miles']"
Merrell Moab 2 Mid Waterproof Hiking Boots - Women's,Merrell,$100.93,"Merrell Moab 2 Waterproof Mid hikers deliver out-of-the-box comfort with durable leather, supportive footbeds and Vibram® traction. Wear them and you'll know why Moab stands for Mother-Of-All-Boots.",4.6,https://www.rei.com/media/729e9393-a31d-4803-8319-afc2b96be454?size=784x588,"['Performance suede leather and mesh uppers have protective rubber toe caps', ""M Select Dry membranes seal out water and let moisture escape so you stay dry when you're on the move"", 'Bellowed, closed-cell foam tongues keep moisture and debris out', 'Merrell M Select Fit.Eco+ blended-EVA, contoured footbeds with zonal arch and heel support', 'Merrell Air Cushion in the heels absorbs shock and adds stability', 'EVA midsoles provide stability and comfort', 'Molded nylon arch shanks add stability', 'Vibram TC5+ outsoles have a 5mm lug depth for grip']"
Merrell Moab 2 Mid Waterproof Hiking Boots - Men's,Merrell,$100.93,"Merrell Moab 2 Mid waterproof hikers deliver out-of-the-box comfort with durable leather, supportive footbeds and Vibram® grip. You'll soon understand why Moab stands for Mother-Of-All-Boots.",4.2,https://www.rei.com/media/3c402fb4-f707-4819-baa5-318d85d01cbc?size=784x588,"['Performance suede leather and mesh uppers have protective rubber toe caps', ""M Select Dry membranes seal out water and let moisture escape so you stay dry when you're on the move"", 'Bellowed, closed-cell foam tongues keep moisture and debris out', 'Merrell M Select Fit.Eco+ blended-EVA, contoured footbeds with zonal arch and heel support', 'Merrell Air Cushion in the heels absorbs shock and adds stability', 'EVA midsoles provide stability and comfort', 'Molded nylon arch shanks add stability', 'Vibram TC5+ outsoles have a 5mm lug depth for grip']"
Merrell Moab 2 Waterproof Hiking Shoes - Women's,Merrell,$93.93,"Experience out-of-the-box comfort in Merrell Moab 2 waterproof hiking shoes. With durable leather, supportive footbeds and Vibram® traction, you'll understand why Moab stands for Mother-Of-All-Boots.",4.4,https://www.rei.com/media/07d0a99f-23ef-425c-8bd8-a8d3c1a0f5bc?size=784x588,"['Performance suede leather and mesh uppers have protective rubber toe caps', 'Waterproof breathable membranes protect your feet from the weather; breathable mesh linings', 'Bellowed, closed-cell foam tongues keep moisture and debris out', 'Merrell M Select Fit.Eco+ blended-EVA, contoured footbeds with zonal arch and heel support', 'Merrell Air Cushion in the heels absorbs shock and adds stability', 'EVA midsoles provide stability and comfort', 'Molded nylon arch shanks add stability', 'Vibram TC5+ outsoles have a 5mm lug depth for grip']"
Timberland Mt. Maddsen Mid Waterproof Hiking Boots - Men's,Timberland,$109.95,"Crafted of full-grain leather, the men's Mt. Maddsen Mid waterproof hiking boots offer rugged, trail-worthy performance and comfort for long miles in the wilderness.",4.5,https://www.rei.com/media/53a03193-14c6-4588-9010-e3111501c216?size=784x588,"['TimberDry™ waterproof membranes—made with 52% recycled polyester (PET)—help keep feet dry', 'Premium full-grain, waterproof leather is sourced from a Silver-rated tannery that follows strict environmental standards', 'Fully gusseted tongues provide comfort and keep debris out', 'Exclusive anti-fatigue comfort technology provides all-day comfort and support', 'Internal TPU shanks add torsional rigidity', 'Compression-molded EVA midsoles provide lightweight cushioning and shock absorption', 'Green Rubber outsoles are made from 42% recycled rubber; lugs offer excellent traction']"
Merrell Moab 2 Ventilator Hiking Shoes - Men's,Merrell,$76.93,"Merrell Moab 2 Ventilator hiking shoes offer ventilation, out-of-the-box comfort, durable leather, supportive footbeds and Vibram® traction. Wear them and see why Moab stands for Mother-Of-All-Boots.",4.5,https://www.rei.com/media/2d31ec91-cba9-4021-a5d1-92206156855b?size=784x588,"['Performance suede leather and mesh uppers have protective rubber toe caps; breathable mesh lining', 'Bellowed, closed-cell foam tongues keep moisture and debris out', 'Merrell M Select Fit.Eco+ blended-EVA, contoured footbeds with zonal arch and heel support', 'Merrell Air Cushion in the heels absorbs shock and adds stability', 'EVA midsoles provide stability and comfort', 'Molded nylon arch shanks add stability', 'Vibram TC5+ outsoles have a 5mm lug depth for grip']"
Salomon OUTline Mid GTX Hiking Boots - Men's,Salomon,$74.83,"Tackle new trails in the Salomon OUTline Mid GTX men's hiking boots. A GORE-TEX® liner, flexible feel and rugged traction keep you comfortable and protected for miles of backcountry adventures.",4.2,https://www.rei.com/media/8dcecf01-3ede-48a8-8487-06de3306588f?size=784x588,"['Over-the-ankle height provides added ankle protection and stability', 'Built using a running last with integrated features and great flexibility for a sleek, agile experience', 'GORE-TEX® waterproof liners keep your feet dry and comfortable regardless of the forecast', 'Protective toe caps guard against rocks, roots and other trail obstacles', 'Gusseted tongues keep debris out so you can focus on the trail', 'Midfoot shanks add stability while allowing feet to move unencumbered', 'Removable OrthoLite® footbeds add shock absorption; antimicrobial treatment inhibits growth of odor-causing bacteria on footwear', '5mm deep lugs with reverse chevron pattern help the nonmarking Contagrip® outsoles claw to any surface']"
REI Co-op Flash Hiking Boots - Women's,REI Co-op,$74.83,"Fly over trails in the waterproof, breathable women's REI Co-op Flash hiking boots that are comfy right out of the box. REI-exclusive technologies create fast-and-light boots—with a lighter footprint.",4.0,https://www.rei.com/media/f61192d0-da80-4e2f-896f-3fadabc729e9?size=784x588,"['Strong and socklike FirmaKnit™ uppers are made from 99% recycled PET polyester and are designed for lightweight yet durable comfort right out of the box', ""HydroWall™ complete waterproof/breathable protection keeps your feet dry when the trail ahead isn't—and uses 75% recycled polyester to do so"", '20% recycled rubber TerraGrip™ tread provides anti-slip grip on all kinds of terrain with 4 mm forefoot climbing lugs for going up and 4 mm heel braking lugs for coming down', 'TerraLoft™ midsoles use 10% algae-based BLOOM™ foam to cradle your feet with a cushioning system that feels like your favorite trail-running shoes (soft, but not too soft)', ""TrailBed™ insoles use Insite® Contoura® technology created with podiatrists to ensure support and comfort; plus, it's made with 25% USDA-certified bio-based Susterra® compound"", ""2-layer 30% recycled TPU overlays are designed to create durable and supportive uppers—the structure you need for long hours on the trail that's still light and minimalist"", 'Molded nylon midfoot shanks provide lightweight support to protect your feet from the trail and help propel you forward', 'Recycled PET polyester webbing and lacing creates a midfoot cradle system that allows for a highly adjustable and locked-down fit', 'Extra space in the toe boxes allows for natural changes in your feet (like swelling) during hours of trail exploration', 'Informed by feedback from over 6,000 people and field tested by 100 co-op members over 2,000 hours and 700+ miles']"
Salomon X Ultra 3 Mid GTX Hiking Boots - Men's,Salomon,$122.93,"Wet conditions, tough descents and long hikes are no problem for the men's Salomon X Ultra 3 Mid GTX hiking boots. They provide the cushioning and flexibility needed for comfy, stable steps.",4.2,https://www.rei.com/media/95bcfe60-1761-479b-ae60-a583414f93a6?size=784x588,"['Gore-Tex® waterproof bootie liners let your feet breathe while protecting them from the elements', 'Sculpted to hold your feet in place and prevent slippage for more stable descents', 'Advanced chassis are surrounded by foam cushioning for comfort and connect directly to the soles to stabilize your heels', 'Soft textile linings wick moisture away from feet', 'Mid-cut profile adds ankle support and protection, providing all-day comfort on the trail', 'Tongue gussets block debris from getting inside', 'Injection-molded EVA midsoles provide excellent cushioning underfoot', 'Ortholite sockliners combine a specific Ortholite foam and contoured EVA heel cups for enhanced heel support', 'Mud guards and integrated rubber toe caps provide durable protection from roots and rocks', 'Unique outsole pattern with combination of 2 types of rubber helps you grip terrain more aggressively', ""Specifically placed lines on the outsoles increase the shoes' flexibility, helping decrease foot fatigue""]"
Merrell Moab 2 Mid Ventilator Hiking Boots - Women's,Merrell,$83.93,"Enjoy out-of-the-box comfort in the Merrell Moab 2 Mid Ventilator hikers. With durable leather, supportive footbeds and Vibram® traction, you'll understand why Moab stands for Mother-Of-All-Boots.",4.6,https://www.rei.com/media/3601c0d0-77e9-4108-a4f3-c5539e71f016?size=784x588,"['Performance suede leather and mesh uppers have protective rubber toe caps; breathable mesh linings', 'Bellowed, closed-cell foam tongues keep moisture and debris out', 'Merrell M Select Fit.Eco+ blended-EVA, contoured footbeds with zonal arch and heel support', 'Merrell air cushion in the heels absorbs shock and adds stability', 'EVA midsoles provide stability and comfort', 'Molded nylon arch shanks add stability', 'Vibram TC5+ outsoles have a 5mm lug depth for grip']"
Merrell MQM Flex 2 Mid GORE-TEX Hiking Boots - Women's,Merrell,$111.93,"Move quickly on the trails in the women's Merrell MQM Flex 2 Mid GORE-TEX hiking boots. Inspired by trail runners but made to hike, they're fast up front, protective in back and ready for wet weather.",4.2,https://www.rei.com/media/47d543c6-46b3-4752-8d8d-03681a267813?size=784x588,"['Waterproof, tear-resistant mesh uppers fend off wet weather; thermoplastic polyurethane toe caps protect your feet from rocks and roots', 'GORE-TEX® waterproof/breathable membranes help your feet stay comfortable and dry; bonded construction ensures they fit and feel like unprotected shoes', 'Tongue-integrated lacing system provides a more secure fit; bellows tongue keeps debris out', 'Kinetic Fit™ Base removable contoured insoles provide flexible support', 'FLEXconnect™ dual-directional flex-groove EVA foam midsoles enhance flexibility and stability', 'Rock plates offer underfoot protection', 'Mountain-grade Quantum Grip™ rubber outsoles with 5mm lugs provide rugged traction', 'Merrell Air Cushion in the heels absorbs shock and adds stability']"
Topo Athletic Trailventure Hiking Boots - Women's,Topo Athletic,$97.93,"Providing lightweight durability, protection and traction on rugged terrain, the women's Topo Athletic Trailventure hiking boots tune in to hit the peak of the trail quickly and comfortably.",4.1,https://www.rei.com/media/4eddaed5-fb54-45dd-ae5e-5c0c70b1d6d8?size=784x588,"['Abrasion-resistant ripstop mesh upper is light, durable and breathable', 'Over-the-ankle molded foam collar provides additional support and security on more challenging terrain', '3-piece EVA midsoles deliver a cushioned, dynamic experience with light underfoot guidance through the step', 'Rear rock plates and hard rubber capped toes offer front-and-back protection while hiking on loose, rocky ground', 'Vibram® XS Trek rubber outsoles feature durable, multisurface traction for all types of terrain', 'Drainage ports release water to dry quickly after crossing streams or encountering inclement weather']"
KEEN Targhee Mid Waterproof Hiking Boots - Kids',KEEN,$79.95,"Encourage their adventurous spirit with the kids' KEEN Targhee Mid Waterproof hiking boots. These rugged boots are waterproof and breathable, so not even Mother Nature can get in their way.",3.8,https://www.rei.com/media/1fba53d1-123f-49fd-b7ca-fc5af8c3ea71?size=784x588,"['KEEN.Dry waterproof, breathable membranes seal out the elements—perfect for rainy hikes, muddy trails and creek crossings', ""Bungee laces adjust with a single pull, quickly customizing the fit; little kids' sizes (8K-13K) also sport hook-and-loop closures at the ankles"", 'Lace-capture system keeps laces out of the way, reducing the likelihood of tripping or snagging laces on roots or rocks', 'Padded tongues and collars keep their feet comfortable for all-day adventures', ""Thermoplastic urethane (TPU) heel-capture system helps stabilize young hikers' feet on uneven terrain"", 'Nonmarking rubber outsoles provide terrific grip for tackling the trail']"
Salomon Outpulse Mid GORE-TEX Hiking Boots - Men's,Salomon,$160.00,"When you don't have time to tiptoe over creeks, the men's Salomon Outpulse Mid GORE-TEX hiking boots propel you forward, delivering premium energy return and a fluid stride in a waterproof package.",4.3,https://www.rei.com/media/b02a618d-1d79-4eca-bb72-e7250ed25515?size=784x588,"['Mid cut supports your ankles, and full rubber toe caps deliver protection on rocky trails', 'GORE-TEX® waterproof/breathable membranes shelter your feet from the elements', 'Fuze Surge midsoles keep rebound levels high with a responsive EVA-based foam that delivers pillowy cushioning and a springy step', 'Lightweight Energy Blade Outdoor TPU plates are engineered into the front of the boots to filter the ground to help smooth your pacing', 'Reverse camber shape is curved to keep you rolling with a natural and fluid stride', 'Contagrip® rubber outsoles grip the ground through unpredictable conditions']"
Merrell Moab 2 Ventilator Hiking Shoes - Women's,Merrell,$76.93,"Merrell Moab 2 Ventilator women's hikers offer out-of-the-box comfort, durable leather, supportive footbeds and Vibram® traction. Put them on and you'll know why Moab stands for Mother-Of-All-Boots.",4.6,https://www.rei.com/media/52e76f34-0532-436a-9634-c5790332a9e4?size=784x588,"['Performance suede leather and mesh uppers have protective rubber toe caps; breathable mesh linings', 'Bellowed, closed-cell foam tongues keep moisture and debris out', 'Merrell M Select Fit.Eco+ blended-EVA, contoured footbeds with zonal arch and heel support', 'Merrell Air Cushion in the heels absorbs shock and adds stability', 'EVA midsoles provide stability and comfort', 'Molded nylon arch shanks add stability', 'Vibram TC5+ outsoles have a 5mm lug depth for grip']"
Merrell Ontario 2 Mid Waterproof Hiking Boots - Women's,Merrell,$155.00,"Get durable, dependable performance on the trail with the women's Merrell Ontario 2 Mid waterproof hiking boots, featuring sticky traction soles and allover leather uppers for a classic, clean design.",4.6,https://www.rei.com/media/d80c1b1e-862e-43d7-a0b9-017e2cb05b02?size=784x588,"['Waterproof full-grain leather uppers add durability', 'Waterproof/breathable membranes seal out water and let moisture escape', 'Mesh linings add breathability', 'Bellows tongues keep out debris', 'Traditional lace closures feature metal hooks and D-rings', 'Kinetic Fit™ BASE contoured, removable insoles provide flexible support', 'Lightweight EVA foam midsoles offer stability and comfort', 'Merrell Air Cushion in the heels absorb shock and add stability', 'Vibram® Megagrip rubber outsoles provide traction and durability on wet or dry surfaces']"
Merrell Ontario 85 Mid Waterproof Hiking Boots - Women's,Merrell,$107.93,"Add confidence to any adventure. Inspired by Merrell hiking boots from 1985, these Ontario 85 Mid Waterproof hiking boots feature performance CORDURA® uppers and sticky Vibram® Megagrip rubber soles.",4.4,https://www.rei.com/media/3ca2d537-c0ea-415b-b4e6-6f92f521a88c?size=784x588,"['CORDURA® fabric and pigskin uppers resist tears and abrasion; metal hooks and D-rings secure the laces', 'M Select DRY impermeable membranes seal out water, while letting moisture escape', 'Bellows tongues keep out debris', 'Breathable mesh linings', 'Removable Kinetic Fit™ BASE contoured insoles offer flexible support', 'Merrell Air Cushion in the heels absorbs shock and adds stability', 'EVA foam midsoles provide stability and comfort', 'Vibram® Megagrip rubber outsoles with a 3 mm lug depth deliver excellent traction']"
Merrell Moab 2 Waterproof Hiking Shoes - Men's,Merrell,$93.93,"For Merrell, Moab stands for Mother-Of-All-Boots. Experience out-of-the-box comfort in Merrell Moab 2 waterproof men's hikers with their durable leather, supportive footbeds and Vibram® traction.",4.4,https://www.rei.com/media/f48902f7-21b2-43ff-9689-44989062fa6d?size=784x588,"['Performance suede leather and mesh uppers have protective rubber toe caps', 'Waterproof breathable membranes protect your feet from the weather; breathable mesh linings', 'Bellowed, closed-cell foam tongues keep moisture and debris out', 'Merrell M Select Fit.Eco+ blended-EVA, contoured footbeds with zonal arch and heel support', 'Merrell Air Cushion in the heels absorbs shock and adds stability', 'EVA midsoles provide stability and comfort', 'Molded nylon arch shanks add stability', 'Vibram TC5+ outsoles have a 5mm lug depth for grip']"
Merrell Zion Mid Waterproof Hiking Boots - Men's,Merrell,$104.93,"Blending a sneaker fit with a trail-running platform, the men's Merrell Zion Mid waterproof hiking boots have durable uppers and Vibram® Megagrip outsoles for aggressive grip on every terrain.",3.7,https://www.rei.com/media/cf17030b-64d4-489d-a9ed-b5d7ef9987e6?size=784x588,"['Waterproof full-grain leather and ballistic mesh uppers with M-Select Dry technology to seal out the elements', 'Breathable mesh linings', 'Metal eyelets and integrated webbing loops provide secure lacing', 'Bellows tongue helps keep debris out', 'Rubber toe caps offer protection against bumps', 'Merrell Kinetic Fit™ Base removable contoured footbeds provide flexible support', 'Compression-molded EVA midsoles offer stability and comfort; dual-density EVA inserts in the rearfoot and forefoot provide extra cushioning', 'Vibram® Megagrip outsoles have 5mm deep lugs for excellent traction', 'Lightweight FlexPlate™ technology provides torsional rigidity for tackling uneven terrain']"
HOKA Anacapa Mid GTX Hiking Boots - Men's,HOKA,$185.00,"Consider these shoes your gateway to the great outdoors. Light, grippy, waterproof and versatile, the men's HOKA Anacapa Mid GTX hiking boots are an easy pick for any trail.",4.1,https://www.rei.com/media/c634305a-5af3-404a-8e75-fa0fff6547a5?size=784x588,"['Lightweight nubuck leather/GORE-TEX® uppers seal out wet weather', 'PFC-free durable water repellent (DWR) treatment helps moisture bead up on the surface of footwear', 'Quick-lace hook hardware secures your fit fast', 'Gusseted tongues help mitigate trail debris', 'Achilles-cradling pull tabs offer easy on/off', 'Molded PU sockliners derived from 50% soybean oil offer comfort', 'Compression-molded EVA midsoles provide a balanced, cushioned ride', 'Extended heel geometry allows for smoother heel-to-toe transitions', 'Vibram® Megagrip rubber outsoles offer superior traction on uneven terrain', 'Polyester in the collar, mesh and laces is recycled', 'Leather certified by the Leather Working Group']"
Merrell Altalight Knit Mid Hiking Boots - Men's,Merrell,$132.93,Trek far in these light yet rugged boots. The men's Merrell Altalight knit mid hiking boots boast abrasion-resistant uppers and sticky soles to keep you steady on slippery trails and long-haul hikes.,4.0,https://www.rei.com/media/9b83ce89-aa9d-4863-a68c-b09bf0a15fe4?size=784x588,"['Rugged knit uppers resist abrasion; metal hooks and eyelets allow for secure lacing', 'Stratafuse™ exoskeletons provide a glovelike fit and extremely lightweight support', 'Bellows tongue keeps debris out of your boots', 'Kinetic Fit™ Base removable contoured insoles provide flexible support', 'EVA foam midsoles lend stability and comfort; lightweight FlexPlate™ technology provides torsional rigidity in shoes', 'Vibram® Megagrip outsoles with 5mm lugs provide traction on wet and dry surfaces', 'Merrell Air Cushion in the heels absorbs shock and adds stability', 'Merrell Flex Index Grade: 4 (on a scale of 1–8, with 1 having the greatest flex and 8 having no flex)']"
