title,brand,price,description,rating,image,feature
KEEN Targhee Vent Hiking Shoes - Men's,KEEN,$154.95,Tackle the trail with confidence in the men's KEEN Targhee Vent hiking shoes. They boost traction with grippy rubber outsoles and have a heel-capture system that promotes stability with every step.,4.5,https://www.rei.com/media/d0ca2dcf-1a8e-40e2-9dd1-317447b502b9?size=784x588,"['Removable metatomical dual-density EVA footbeds cushion your stride', 'Injected TPU heel-capture system promotes stability as you hike', 'Reinforced eyelets are durable and allow easy adjustment', 'KEEN all-terrain rubber outsoles lend high-traction grip']"
Danner Trail 2650 Hiking Shoes - Men's,Danner,$189.95,"Inspired by the demanding terrain along the 2,650-mile Pacific Crest Trail, the Danner men's Trail 2650 hiking boots keep you pushing forward with tough, breathable construction and grippy traction.",4.5,https://www.rei.com/media/082c5485-58bc-4642-a7b9-e71eaa4b51d2?size=784x588,"['Durable, lightweight leather and textile uppers', 'Mesh liners improve breathability', 'Reinforced, external heel counters provide support', 'Lightweight, shock-absorbent EVA midsoles are topped with open-cell OrthoLite® footbeds for cushioning', 'TRAILGUARD platforms with exposed TPU shanks offer lightweight, athletic performance', 'Vibram® 460 outsoles with Megagrip technology offer strong grip on wet and dry surfaces', 'Danner indicates these shoes fit true to size']"
Danner Inquire Chukka Mid Hiking Boots - Women's,Danner,$179.95,"Built for daring trekkers exploring new terrain, the women's Danner Inquire Chukka Mid hiking boots keep your feet steady, dry and supported as you climb steep trails and navigate city streets.",4.6,https://www.rei.com/media/08d7fc64-fb3b-4e97-8deb-387dc77665c7?size=784x588,"['Danner® Dry waterproof breathable membranes fend off foul weather', 'Custom Vibram® Inquire outsoles with multidirectional lugs, adaptive heels and Megagrip technology offer reliable grip on wet or dry surfaces', 'Danner® Plyolite™ EVA midsoles offer support and rebound', 'Suede and textile uppers and lightweight and durable', 'Open-cell OrthoLite® footbeds provide cushion', 'TRAILGUARD platforms feature exposed thermoplastic polyurethane (TPU) shanks for lightweight support', 'Danner indicates these boots fit true to size']"
KEEN Targhee III Waterproof Mid Hiking Boots - Women's,KEEN,$174.95,"Trail-tested for over 15 years, the women's KEEN Targhee III Waterproof Mid hiking boots have a light, casual feel for everyday wear, plus rugged, waterproof protection for full days on the trail.",4.3,https://www.rei.com/media/fa4df5cc-474e-4b36-bf81-05a095109238?size=784x588,"[""Offering out-of-the-box comfort and a feel that's more like sneakers than traditional hikers, these boot can also be worn as comfort shoes"", 'Uppers are built to last with leather from a tannery rated gold by the Leather Working Group (LWG) for environmental stewardship and traceability', 'KEEN.DRY provides waterproof/breathable protection for hiking in any conditions', 'Toe and mud guards add durability', '4 mm multidirectional lugged soles deliver reliable, trail-ready traction', 'Original KEEN comfort fit provides plenty of room for toes to spread out and a secure heel for stability']"
Danner Trail 2650 GTX Hiking Shoes - Men's,Danner,$209.95,Move quickly and confidently across both wet and dry terrain with the men's Danner Trail 2650 GTX hiking shoes. They're ideal for casual day hikes or when you're looking to get some serious mileage.,4.2,https://www.rei.com/media/83f81d8e-19ff-4a2d-bdc1-d4d61bd22942?size=784x588,"['Lightweight, durable leather and textile uppers are lined with waterproof/breathable GORE-TEX®', 'Open-cell OrthoLite® footbeds and lightweight, shock-absorbing PlyoGo EVA midsoles cushion every step', 'Lightweight Trailguard thermoplastic urethane shanks and EXO heel system provide stability, support and comfort on challenging trails', 'Vibram® 460 outsoles with MegaGrip technology offer superior grip on wet and dry surfaces alike', 'Danner indicates these shoes fit true to size']"
Oboz Sapphire Mid Waterproof Hiking Boots - Women's,Oboz,$160.00,"Tackle any trail in the weather-protective comfort of Oboz Sapphire Mid waterproof hiking boots. They were designed, developed and tested with a woman's fit and needs in mind.",4.3,https://www.rei.com/media/57df57cf-1c47-4fd5-b80e-f187b613cd76?size=784x588,"[""Asymmetric collars are engineered for the unique medial and lateral bones of women's feet, so the boots comfortably articulate with ankle motion"", ""Articulated uppers allow uninhibited forward motion, yet support the ankles laterally when you're on crooked crags and steep slopes"", 'Nubuck leather uppers with B-DRY waterproof/breathable membranes, soft-touch leather heel collars and durable polyurethane-coated leather toe and heel guards', 'Insoles provide support across the arches to optimize strength, flexibility and propulsion', 'Tuned, single-density EVA midsoles provide soft cushioning, while thermoplastic urethane chassis provide all-day protection', 'Board lasted; EVA Super Skin (ESS) forefoot armoring; nylon shanks', 'Grippy outsoles help keep you on your feet', 'Oboz plants a tree for every pair of shoes sold, in partnership with Trees for the Future']"
KEEN Targhee II Waterproof Hiking Shoes - Men's,KEEN,$154.95,"The men's KEEN Targhee II waterproof hiking shoes deliver tenacious traction, stability and comfort on a wide variety of trails.",3.8,https://www.rei.com/media/ec5f75da-3503-4bfc-b352-40abb8f94556?size=784x588,"['Waterproofed nubuck leather and flexible nylon mesh uppers offer ample durability, flexibility and breathability for comfort on the go', 'KEEN.DRY™ waterproof breathable membranes keep feet dry while allowing perspiration to dissipate before it saturates the inside of the shoe', 'Secure-fit lace capture system with sturdy nylon webbing eyelets and heel wrap help lock feet to footbeds for increased support', 'Webbing pull loops at heel and tongue allow easy entry/exit; padded, gusseted tongues keep out debris and moisture while relieving lace pressure', 'Metatomical EVA footbeds are shaped to provide ample cushioning and arch support; can also accommodate orthotics', 'Compression-molded EVA midsoles offer shock absorption and padding for all-day comfort', 'Supportive nylon shanks provide torsional stability and protection from uneven terrain', 'Patented rubber Toe Guards protect feet and uppers from impacts and abrasion', 'Nonmarking carbon rubber outsoles with aggressive 4mm multidirectional lugs deliver durability and traction', 'Fit tip: runs about a 1/2 size small']"
Altra Lone Peak ALL-WTHR Mid Hiking Boots - Men's,Altra,$180.00,"Pack up and head out in the men's Altra Lone Peak ALL-WTHR Mid waterproof hiking boots. Whether you're taking on a day hike, an overnighter, a weeklong trek or a thru-hike, these are ready to romp.",3.8,https://www.rei.com/media/36260417-b8c6-4349-9400-504bff0041b4?size=784x588,"['eVent® weatherproof bootie construction keeps your feet dry while also providing breathability', 'Altra EGO™ midsoles offer a responsive yet soft ride for every step of your journey', 'Supportive TPU heels add protection and durability', 'FootShape™ toe boxes allow the toes to relax and spread out naturally and the big toe to remain in a straight position', 'Balanced Cushioning™ platform places the heel and forefoot the same distance from the ground, which encourages low-impact landings', 'Rugged, grippy DuraTread™ outsoles excel on rocky terrain', 'Stack height: 25 mm']"
KEEN Durand II Mid Waterproof Hiking Boots - Men's,KEEN,$209.95,"The American-built KEEN Durand II Mid Waterproof men's hiking boots use waterproof membranes, arch support and breathable linings to keep you comfortable from the first step to the millionth.",4.2,https://www.rei.com/media/329d5923-c435-4a4b-9552-022d37e97f93?size=784x588,"['KEEN.Dry waterproof, breathable membranes let vapor out without letting water in', 'Removable, dual-density EVA footbeds with arch support for comfort', 'Contoured heel-lock provides a secure fit', 'Speed hooks ensure easy lace adjustment', 'Natural odor control', 'Rubber outsoles have 4mm multidirectional lugs for increased traction']"
Salomon Quest Element GTX Hiking Boots - Men's,Salomon,$141.93,You dream of following unknown paths to wild places. Find them—and protect your feet—with the light weight and flexibility of the men's Salomon Quest Element GTX hiking boots.,4.0,https://www.rei.com/media/7262366f-58c3-4eed-8fdf-af5ed13505b6?size=784x588,"['Patented ADV-C chassis stabilize your ankles while letting your feet move freely for agility on uneven terrain', 'Durable nubuck leather and a high cut help shield your feet from obstacles', 'GORE-TEX® keeps your feet dry from the elements—and breathes to release sweat', 'Molded OrthoLite® sockliners match the contours of your feet', 'Contagrip® TD soles offer extended durability while their deep, aggressive lug pattern gives you maximum traction on mixed terrain']"
The North Face Ultra 111 WP Trail-Running Shoes - Men's,The North Face,$129.00,"Go-anywhere, do-anything shoes for trail running or hiking, The North Face Ultra 111 WP shoes offer a robust feature set that excels on any terrain and in any conditions.",4.0,https://www.rei.com/media/28eb4c47-1523-4e5b-9adf-890be39b34c5?size=784x588,"['Performance mesh uppers are backed with DryVent® membranes for waterproof/breathable protection from the elements', 'Integrated ghillie lacing system', 'OrthoLite® Hybrid™ footbeds blend 5% recycled rubber and 15% production-waste foam to provide lightweight cushioning and moisture management with 20% eco-content', 'PU-coated leather mud guards and collars; protective toe caps', 'Single-density EVA midsoles provide cushioning', 'ESS midfoot shanks offer support', 'UtrATAC™ rubber outsoles']"
Lowa Renegade GTX Mid Hiking Boots - Men's,Lowa,$245.00,"With abundant comfort and support at a low weight, the men's waterproof Lowa Renegade GTX Mid hiking boots are well-suited for long day hikes and weekend backpacking.",4.2,https://www.rei.com/media/c2fad279-0860-466a-b762-17bff331aab3?size=784x588,"[""Waterproof, breathable GORE-TEX® liners keep your feet dry when you're stepping in shallow streams and hiking hard"", 'Water-repellent nubuck leather uppers feature Cordura® nylon ankle bands for comfort and flexibility; polyester linings wick moisture to help keep feet dry inside', 'Derby-cut lacing fits a wide variety of foot volumes; padded and gusseted tongues relieve lace pressure while keeping out trail debris', 'Full-length nylon shanks offer great support for long days on your feet; polyurethane midsoles absorb shock', 'External polyurethane Monowrap® frames offer lateral stability while reducing weight', ""Vibram® Evo rubber outsoles on the men's Lowa Renegade GTX Mid hiking boots deliver excellent traction on a wide variety of terrain"", 'Lowa is the official boot sponsor of the American Hiking Guides Association (AHGA)', ""Inducted in the Editors' Choice 25th Anniversary Hall of Fame by Backpacker magazine (2018)"", 'Made in Slovakia']"
Danner Mountain Light GTX Hiking Boots - Men's,Danner,$399.95,"A reintroduction of an old favorite, Danner Mountain Light GTX men's hiking boots are supportive, comfy, tried-and-true companions for extended backpacking trips and rugged treks in the backcountry.",4.3,https://www.rei.com/media/15b850ed-a9be-4a5c-ac1f-724784ba2b61?size=784x588,"['One-piece, full-grain leather uppers provide durability for the long haul', 'GORE-TEX® waterproof breathable membranes keep water out while allowing sweat and moisture to escape', 'Open-cell OrthoLite® footbeds provide cushioning', 'Vibram® Kletterlift outsoles offer reliable traction, stability and shock absorption on rugged terrain', 'Stitchdown construction is handcrafted to provide a wider platform for increased stability underfoot', 'Built by hand in Portland, Ore.', 'Second lace option of flat red included', 'These boots have an EE width and are designed to fit an average-width foot (similar to a D width); they offer a more relaxed fit while still providing support and stability', 'Since this style runs a little long, Danner recommends sizing down a half size for the best fit']"
Lowa Tibet GTX Hiking Boots - Men's,Lowa,$400.00,"These workhorses are a cult favorite among hard-core hikers, hunters and backpackers. The super stable Lowa Tibet GTX boots are perfect for carrying lots of weight over long distances.",4.2,https://www.rei.com/media/9b443c48-b2a3-4e74-9a3e-4b81e65adf86?size=784x588,"['Handy I-Lock lacing cams allow you to separate the lace tension between the ankles and the tops of the feet for a better fit', 'Full, high-wall rubber wall around the base of the boots resists abrasion', 'Lasted Gore-Tex® lining provides waterproof/breathable protection against the elements', 'Vibram® rubber outsoles offer solid traction', 'Compatible with strap-on crampons', 'Boots can be resoled']"
Topo Athletic Trailventure 2 Hiking Boots - Men's,Topo Athletic,$160.00,"Make every trail your own with the men's Topo Athletic Trailventure 2 hiking boots. They offer roomy toe boxes and a lightweight, durable and comfortable ride on technical terrain.",4.9,https://www.rei.com/media/2252cbb6-8217-4b67-8dc4-442e767800de?size=784x588,"['Durable mesh uppers offer increased breathability with a secure fit, while medial drainage ports allow for water release and quick drying', 'Antimicrobial OrthoLite® insoles offer additional comfort underfoot and inhibit the growth of odor-causing bacteria on the footwear', '33 x 28 mm cushioned platforms feature ZipFoam™ midsoles for an even more stable and comfortable experience underfoot', 'External TPU heel counters provide heel support and keep your feet secure over the cushioned platform', 'Vibram® XS Trek EVO outsoles offer optimal multisurface traction and durability on all terrain', 'Compatible with Topo Performance Gaiters (not included)']"
Topo Athletic Trailventure 2 WP Hiking Boots - Men's,Topo Athletic,$180.00,"Take on any weather and any trail in the men's Topo Athletic Trailventure 2 WP. These light, rugged, waterproof hiking boots feature signature roomy toe boxes, plus even more cushioning than before.",4.1,https://www.rei.com/media/d7aa0ac9-b186-449a-b1c7-0b7daaf96123?size=784x588,"['Full eVent® waterproof inner-bootie construction locks water out to keep your feet dry and comfortable in any weather condition', 'External TPU heel counters provide heel support and keep the feet secure over the cushioned platform', 'Antimicrobial OrthoLite® insoles offer additional comfort underfoot with odor resistance', '33 x 28 mm cushioned platforms feature ZipFoam™ midsoles for an even more stable and comfortable experience underfoot', 'Full-length ESS rock plates offer total protection from rocks and roots on technical terrain', 'Vibram® Megagrip outsoles offer superior traction and grip on all surfaces, including wet and slippery terrain, while generously spaced lugs optimize mud and snow release', 'Compatible with Topo Performance Gaiters (not included)']"
Xero Shoes Xcursion Fusion WP Hiking Boots - Men's,Xero Shoes,$150.00,"Stay dry in the men's Xero Shoes Xcursion Fusion WP waterproof hiking boots. Their natural fit, wide toe boxes and flexible design let your feet bend and move naturally and engage with your world.",4.4,https://www.rei.com/media/0cea9668-efb6-4a65-b259-b9d534adc83e?size=784x588,"['Fully waterproof, thanks to seam-sealed inner booties plus water-resistant membranes and gusseted tongues that provide weather protection without excess weight', 'Natural fit—wide toe boxes let your toes naturally spread out and relax', '""XERO-drop"" soles (low to the ground with non-elevated heels) allow for proper posture, balance and agility', '10 mm FeelTrue® outsoles are built with an embedded TrailFoam™ layer and a rugged dual-chevron tread which includes 3.5 mm lugs', 'This outsole construction provides added comfort, protection and great traction while still giving the ground feedback that your feet like', ""Excellent grip and traction designed into dual-chevron tread pattern gives you confidence whether you're going uphill, downhill, fast or slow"", 'Adjustable midfoot straps allow a personalized and secure fit that lets your toes relax', 'Reinforced toe caps protect your toes from roots and rocks on the trail', 'Removable 2 mm insoles let you decide how much ""barefoot feel"" you want', 'Built-in gaiter hooks (gaiters not included)', 'Made with vegan-friendly materials—there are no animal products in these', 'Extremely lightweight at just 1 lb. 10 oz. per pair', 'Note: Xcursion Fusion hiking boots run small; Xero Shoes recommends choosing a half size larger than your usual size']"
Danner Mountain 600 Full-Grain Leather Hiking Boots - Men's,Danner,$229.95,"Blending lightweight comfort and technical hiking function, Danner Mountain 600 full-grain leather hiking boots deliver support, waterproof protection and Vibram® Megagrip traction on muddy trails.",4.4,https://www.rei.com/media/97836dfd-6439-4227-886b-271c67779e69?size=784x588,"['Durable, full-grain leather uppers feature Danner Dry waterproof protection', 'Vibram® SPE midsoles enhance rebound, comfort and support', 'TPU heel frames add support and stability', 'Cushioned OrthoLite® footbeds provide cushioned comfort', 'Vibram Fuga outsoles feature self-adaptive lugs and a Megagrip compound for traction on wet and dry surfaces', 'Danner recommends sizing down half a size from what you typically wear']"
KEEN Targhee Vent Hiking Shoes - Women's,KEEN,$154.95,"With grippy rubber outsoles and a heel-capture system that boosts stability with every step, the women's KEEN Targhee Vent hiking shoes let you tackle your trail adventures with a sense of prowess.",4.5,https://www.rei.com/media/8225c76d-e75e-4e5e-ab1b-776023dba4b9?size=784x588,"['Removable metatomical dual-density EVA footbeds cushion your stride', 'Injected TPU heel-capture system promotes stability as you hike', 'Reinforced eyelets are durable and allow easy adjustment', 'KEEN all-terrain rubber outsoles lend high-traction grip']"
Altra Lone Peak Hiker Hiking Boots - Women's,Altra,$150.00,"Wear 'em from trail to town. The women's Altra Lone Peak Hikers have full trail capabilities to handle heavy-duty hikes with a lightweight feel, but they're equally ready to explore the urban scene.",4.5,https://www.rei.com/media/d0727688-781b-4d23-a20b-a21092fb95d9?size=784x588,"['Altra EGO™ midsoles offer soft responsiveness on and off the trail', 'Altra signature FootShape™ toe boxes allow the toes to relax and spread out naturally and the big toe to remain in a straight position', 'Balanced Cushioning™ platforms place the heels and forefeet the same distance from the ground, which encourages low-impact landings', 'Stack height: 25 mm', 'DuraTread™ outsoles excel on dry dirt and rocky terrain']"
Salomon X Ultra 4 Low Hiking Shoes - Women's,Salomon,$120.00,Explore every angle of freedom with the women's Salomon X Ultra 4 Low hiking shoes. They pair anatomic design with stable platforms and grippy outsoles to help you power through uphills and descents.,3.7,https://www.rei.com/media/bd216022-7272-4cfe-9745-30c1e12dcad3?size=784x588,"['Women-specific design—made with softer materials, especially around the collars and heels, a lower-density chassis and women-specific last', 'Drawing on Salomon trail-running expertise, these hikers are light and agile to keep you nimble on uneven terrain', 'SensiFit™ cradles the feet from the midsole to the lacing system, providing a secure, snug and virtually customized fit all around your feet', 'ADV-C chassis targets articulations on the outer foot to optimize stability while keeping the front of the shoe flexible', ""Contagrip® MA outsoles grab the terrain, even when it's wet or slippery, giving you more control, especially on descents"", 'Durable outsoles can handle a wide variety of surfaces, balancing the geometry and rubber compound to deliver confidence on wet, dry, hard or loose surfaces']"
Lowa Zephyr GTX Mid Hiking Boots - Men's,Lowa,$220.00,"Versatile, durable and comfortable, the waterproof Lowa Zephyr GTX Mid hiking boots outfit your feet for rugged day hikes and weekend backpacking trips through the mountains.",2.0,https://www.rei.com/media/b5ad86e2-0803-4667-9973-883688ec2eb1?size=784x588,"['GORE-TEX® waterproof/breathable membranes supply reliable protection against wetness', 'High polyurethane MONOWRAP® frames provide incredible stability and support without added weight', 'Split-grain leather and fabric uppers stand up to abuse', 'Lugged outsoles offer reliable traction']"
Oboz Bridger Mid Waterproof Hiking Boots - Men's,Oboz,$190.00,"While the leather uppers of the men's Oboz Bridger Mid waterproof hiking boots give a nod to classic hikers of yore, there's nothing old-fashioned about these comfortable yet rugged waterproof boots.",4.3,https://www.rei.com/media/c6c3e90b-52e0-46df-ba59-689f54c75977?size=784x588,"['Oboz plants a tree for every pair of shoes sold, in partnership with Trees for the Future', ""Waterproof nubuck leather uppers offer the right combination of breathability and protection to keep your feet dry on long treks; soft nubuck doesn't require breaking in"", 'B-DRY waterproof/breathable membranes keep soggy elements out while letting water vapor escape, keeping your feet cool and comfortable', 'Nylon mesh linings wick moisture, dry quickly and further enhance breathability', 'Deluxe footbeds feature a well-defined arch for support and nest perfectly inside the boots', 'Dual-density EVA midsoles provide cushioning while keeping the boots light and agile', 'Nylon shanks and thermoplastic urethane forefoot plates offer torsional stability and protection underfoot, increasing surefootedness on varied terrain', 'Rubber randing on the toes and heels helps protect the uppers from abrasion', 'High-friction, nonmarking rubber outsoles grip with ease in all directions on both wet and dry surfaces thanks to the toothy side lugs and 4mm directional lugs underfoot']"
KEEN Ridge Flex Mid Waterproof Hiking Boots - Men's,KEEN,$189.95,"What if every step could be easier? Hike happier in the KEEN Ridge Flex Mid Waterproof men's hiking boots, designed with KEEN.BELLOWS FLEX technology to reduce the energy each step takes.",4.3,https://www.rei.com/media/22a12078-32da-4ce1-8886-5bc11e8ebde0?size=784x588,"['Waterproof leather and performance mesh uppers are backed with KEEN.DRY waterproof, breathable membranes to keep the elements out', 'KEEN.BELLOWS FLEX in the uppers provides more bend and less wear', 'PFC-free, durable water repellent (DWR) finish fends off moisture', 'Speed-lace webbing system provides a comfortably snug fit', 'Quick-dry linings support active use', 'KEEN Comfort Heel Control offers a more secure fit and pads the Achilles; heel-capture system adds stability', 'Stability shanks deliver lightweight support', 'Compression-molded EVA midsoles provide cushioning; removable polyurethane insoles offer long-lasting comfort', 'Eco Anti-Odor for natural odor control', 'High-abrasion rubber tips add durability and protection', 'KEEN.ALL-TERRAIN rubber outsoles deliver high-traction grip; nonmarking, 5 mm multidirectional lugs increase traction']"
Vasque St. Elias GTX Hiking Boots - Men's,Vasque,$220.00,"The men's Vasque St. Elias GTX hiking boots blend rugged, protective materials to provide long-distance durability and all-day comfort, helping you push the boundaries of hiking performance.",4.0,https://www.rei.com/media/b454d4cf-df4b-4aa2-b542-f92c18271da0?size=784x588,"['A.T.C. (All Terrain Compound) midsoles with EVA cushioning pods provide athletic flexibility and comfort upon the first wear with no break-in needed', 'Premium leather uppers and waterproof GORE-TEX® membranes ensure rugged durability in wet conditions', 'Vibram® Frontier outsoles with XSTrek compounds provide surefooted traction', ""Molded rubber toe caps increase foot protection and shoes' durability""]"
adidas TERREX AX4 Mid GORE-TEX Hiking Shoes - Men's,adidas,$140.00,"Stream crossings and wet trails are all part of the experience when you have the adidas TERREX AX4 Mid GORE-TEX hiking shoes to keep your feet dry. After every hike, your feet will sing their praises.",4.7,https://www.rei.com/media/02b86469-2a85-4e80-9b8e-e2f2289973c7?size=784x588,"['Their design merges a lightweight trail-running feel with the stability of mid-height hiking shoes to take on hikes, scrambles and via ferratas', 'Mesh and synthetic uppers (50% recycled) with waterproof GORE-TEX waterproof/breathable membranes let you explore high and low, wet or dry', 'Lightweight EVA midsoles provide long-term cushioning', 'Molded sockliners enhance comfort and fit', 'Continental™ rubber outsoles provide grip in wet or dry conditions, meaning you can trust the AX4 to get you anywhere you want to go without worrying about your feet', 'These shoes are made with Primegreen, a series of high-performance recycled materials; no virgin polyester']"
Scarpa Crux II Approach Shoes - Men's,Scarpa,$139.00,"Offering support and protection on slabby scrambles, loose talus, and rocky trails, the Scarpa Crux II men's approach shoes have full-coverage toe rands, sticky soles and a lace-to-the-toe design.",4.2,https://www.rei.com/media/7dadf6ed-1504-4870-a29e-f6d144616983?size=784x588,"['Durable suede uppers with lace-to-toe design offer a performance fit', 'Rubber toe rands add abrasion resistance', 'Vibram® outsoles with Megagrip rubber supply outstanding traction']"
