title,brand,price,description,rating,image,feature
Salomon Outpulse Mid GORE-TEX Hiking Boots - Women's,Salomon,$160.00,"When you don't have time to tiptoe over creeks, the women's Salomon Outpulse Mid GORE-TEX hiking boots propel you forward, delivering premium energy return and a fluid stride in a waterproof package.",4.5,https://www.rei.com/media/d8d3effa-8dfa-4f05-9db8-5d42f86c9ccc?size=784x588,"['Mid cut supports your ankles, and full rubber toe caps deliver protection on rocky trails', 'GORE-TEX® waterproof/breathable membranes shelter your feet from the elements', 'Fuze Surge midsoles keep rebound levels high with a responsive EVA-based foam that delivers pillowy cushioning and a springy step', 'Lightweight Energy Blade Outdoor TPU plates are engineered into the front of the boots to filter the ground to help smooth your pacing', 'Reverse camber shape is curved to keep you rolling with a natural and fluid stride', 'Contagrip® rubber outsoles grip the ground through unpredictable conditions']"
adidas Terrex Swift R3 GORE-TEX Hiking Shoes - Men's,adidas,$150.00,Move fast—and keep dry. The waterproof adidas Terrex Swift R3 GORE-TEX men's hiking shoes combine the lightweight design and cushioning of trail-running shoes with the stability of hiking boots.,4.4,https://www.rei.com/media/f51ac04d-afda-4ca8-b52b-4691bbbf6a0e?size=784x588,"['Mesh and synthetic uppers provide lightweight comfort', 'GORE-TEX® Performance Comfort waterproof/breathable linings seal out puddles and rain', 'Lightstrike EVA midsoles offer cushioning and flexibility for long-lasting comfort', 'External heel support clips keep your feet locked in and stable while striking', 'Anatomic molded heel cups improve support, fit and comfort', 'Continental™ rubber outsoles provide extraordinary traction in wet and dry conditions']"
HOKA Anacapa Low GTX Hiking Shoes - Men's,HOKA,$170.00,"Elevate your adventures in the men's HOKA Anacapa Low GTX hiking shoes. They're waterproof, low-profile, grippy and light—great for any trail that calls your name.",4.1,https://www.rei.com/media/f345d781-9157-4744-bda6-1b605f80c21e?size=784x588,"['A low-profile take on the Anacapa Mid, these shoes help you move light and fast', 'Lightweight nubuck leather/GORE-TEX® uppers seal out wet weather', 'PFC-free durable water repellent (DWR) treatment helps moisture bead up on the surface of footwear', 'Gusseted tongues help mitigate trail debris', 'Achilles-cradling pull tabs offer easy on/off', 'Molded PU sockliners derived from 50% soybean oil offer comfort', 'Compression-molded EVA midsoles provide a balanced, cushioned ride', 'Extended heel geometry allows for smoother heel-to-toe transitions', 'Vibram® Megagrip rubber outsoles offer superior traction on uneven terrain', 'Polyester in the collar, mesh and laces is recycled', 'Leather certified by the Leather Working Group']"
HOKA Anacapa Low GTX Hiking Shoes - Women's,HOKA,$170.00,"A light, low-profile take on the Anacapa Mid, the women's HOKA Anacapa Low GTX hiking shoes are here to elevate your hikes. They're waterproof, low-profile, grippy and ready to hit the trails.",4.2,https://www.rei.com/media/993a8811-41a0-461f-b16c-112c5e384687?size=784x588,"['Lightweight nubuck leather/GORE-TEX® uppers seal out wet weather', 'PFC-free durable water repellent (DWR) treatment helps moisture bead up on the surface of footwear', 'Gusseted tongues help mitigate trail debris', 'Achilles-cradling pull tabs offer easy on/off', 'Molded polyurethane sockliners—derived from 50% soybean oil—offer comfort', 'Compression-molded EVA midsoles provide a balanced, cushioned ride', 'Extended heel geometry allows for smoother heel-to-toe transitions', 'Vibram® Megagrip rubber outsoles offer superior traction on uneven terrain', 'Polyester in the collar, mesh and laces is recycled', 'Leather certified by the Leather Working Group']"
Salomon X Ultra 4 GORE-TEX Hiking Shoes - Men's,Salomon,$150.00,Get ready to power through uphills and descents in any weather with the men's Salomon X Ultra 4 GORE-TEX hiking shoes. They give you the stability and grip you need to enjoy the trails.,3.2,https://www.rei.com/media/b3c00040-6526-420d-abfe-25d6d875f4fd?size=784x588,"['Backed up by waterproof/breathable GORE-TEX® protection', 'Drawing on Salomon trail-running expertise, these hiking shoes are light and agile to keep you nimble on uneven terrain', 'SensiFit™ cradles the feet from the midsole to the lacing system, providing a secure, snug and virtually customized fit all around your feet', 'Active Support ""mobile wings"" help hold your feet in place and accompany their movement, adapting to their shape and volume', 'ADV-C chassis target articulations on the outer foot to optimize stability while keeping the fronts of the shoes flexible', ""Contagrip® MA outsoles grab the terrain, even when it's wet or slippery, giving you more control, especially on descents"", 'Durable outsoles can handle a wide variety of surfaces, balancing the geometry and rubber compound to deliver confidence on wet, dry, hard or loose surfaces']"
La Sportiva TX4 Approach Shoes - Men's,La Sportiva,$149.00,"Made for long approaches on rugged terrain, the men's La Sportiva TX4 approach shoes sport leather uppers for lasting toughness and Vibram® Megagrip outsoles for traction.",4.4,https://www.rei.com/media/1145d338-2d96-4c95-9cf4-b83d86b77641?size=784x588,"['Vibram Megagrip Traverse outsoles with enhanced stability areas and Trail Bite™ heel braking platforms provide surefootedness', 'Durable leather uppers provide comfort and abrasion resistance in rugged terrain', 'STB Control System™ delivers torsional rigidity and support without encumbering underfoot cushioning', 'Wide forefoot fit for all-day comfort and stability', 'OrthoLite® insoles offer comfort and odor control', 'Low-profile lacing harness', 'Air-injected rubber rands']"
HOKA Sky Kaha GORE-TEX Hiking Boots - Men's,HOKA,$220.00,"Built to make the ups easier and the downs quicker, the men's HOKA Sky Kaha GORE-TEX hiking boots are lightweight, cushioned and waterproof, making them an easy pick for any trail you choose.",4.3,https://www.rei.com/media/9c02a8f8-6061-4cb5-a824-be10b21cf6df?size=784x588,"['GORE-TEX® waterproof booties help keep your feet comfortable and dry regardless of the conditions', 'Full-grain, waterproof leather uppers offer durability while fending off the elements', 'EVA top layer offers plush comfort; bottom layer of rubberized foam offers durable cushioning and a supportive base', 'Vibram® Megagrip high-traction outsoles with 5mm multidirectional lugs provide traction on wet or uneven terrain', 'An adjustable lacing system provides a locked-in fit']"
Altra Lone Peak ALL-WTHR Mid Hiking Boots - Women's,Altra,$180.00,"Pack up and head out in the women's Altra Lone Peak ALL-WTHR Mid waterproof hiking boots. Whether you're taking on a day hike, an overnighter, a weeklong trek or a thru-hike, these are ready to romp.",4.3,https://www.rei.com/media/1c0a40fc-a508-4184-91c1-f9fc3e8aede3?size=784x588,"['eVent® weatherproof bootie construction keeps your feet dry while also providing breathability', 'Altra EGO™ midsoles offer a responsive yet soft ride for every step of your journey', 'Supportive TPU heels add protection and durability', 'FootShape™ toe boxes allow the toes to relax and spread out naturally and the big toe to remain in a straight position', 'Balanced Cushioning™ platform places the heel and forefoot the same distance from the ground, which encourages low-impact landings', 'Rugged, grippy DuraTread™ outsoles excel on rocky terrain', 'Stack height: 25 mm']"
Salomon OUTpulse GORE-TEX Low Hiking Shoes - Women's,Salomon,$140.00,"Ready to propel you on your outdoor adventures, the women's Salomon OUTpulse GORE-TEX Low hiking shoes mix protective grip with cushioning, energy return and shelter from the elements.",4.5,https://www.rei.com/media/51739e5e-393a-43bf-b074-2687a0b3b903?size=784x588,"['GORE-TEX waterproof/breathable membranes shield your feet from wet weather', ""Inspired by the brand's ski heritage, the reverse camber curved midsole geometry provides a floaty, fluid feel with each step"", 'Full rubber toe caps offer protection from roots and rocks', 'Fuze Surge foam compound delivers premium energy return and cushioning', 'Engineered into the forefoot area of the bottom unit, the lightweight Energy Blade TPU plate helps deliver a smooth, dynamic stride', 'Contagrip® rubber outsoles provide sure grip in unpredictable conditions']"
HOKA Speedgoat Mid 2 GTX Hiking Boots - Women's,HOKA,$170.00,"A force to be reckoned with, these are speed hikers with an upgrade. The women's HOKA Speedgoat Mid 2 GTX boots have GORE-TEX® protection, more ankle support and Vibram® Megagrip outsoles.",4.4,https://www.rei.com/media/157a1b13-a6f1-4e4a-9dce-bffc201afb70?size=784x588,"['Lightweight and breathable GORE-TEX® waterproof booties keep your feet dry in a variety of seasons and weather conditions; water-resistant mesh uppers fend off precipitation', 'Anatomically designed molded foam collars provide additional ankle support', 'Zonal rubber placement adds support and stability', 'Midsoles now feature a lightweight EVA foam for a more responsive ride', 'Wider forefoot offers a more stable ride and accommodating fit', 'Vibram® Megagrip rubber outsoles with 5mm stepped lugs help keep you stable on slippery, wet and uneven surfaces', '4mm heel-to-toe drop']"
Oboz Sapphire Low Waterproof Hiking Shoes - Women's,Oboz,$140.00,"Trek the trails in the breathable comfort and weather protection of Oboz Sapphire Low waterproof hiking shoes. They're designed, developed and tested with the fit and needs of women's feet in mind.",4.4,https://www.rei.com/media/b58c3e82-54c9-4654-979a-5ae04bc33d87?size=784x588,"['Midsoles are calibrated to a women-specific foot shape, creating the right amount of support without the added bulk', 'O Fit Insole™ comfort combines tuned EVA midsoles for soft cushioning with thermoplastic urethane chassis for stability and protection', 'Waterproof nubuck leather and highly abrasion-resistant textile uppers feature B-DRY waterproof/breathable membranes', 'Board lasted construction creates a sturdy feel underfoot', 'EVA Super Skin (ESS) forefoot armoring provides protection and support underfoot', 'Women-specific Swiftcurrent outsoles offer durability, stability and comfort; lugs provide ample traction for rugged trails or strolling down the street', 'Oboz plants a tree for every pair of shoes sold, in partnership with Trees for the Future']"
Oboz Sawtooth X Low Waterproof Hiking Shoes - Women's,Oboz,$150.00,"Even more capable than the original, the women's Oboz Sawtooth X Low Waterproof hiking shoes retain the same great fit and let you take on wet trails with improved comfort, traction and durability.",3.1,https://www.rei.com/media/b38770b1-ca70-4cf0-986a-7c0e9ccd3b7a?size=784x588,"['The Sawtooth X series is named for the 10th anniversary of the original Sawtooth hiking footwear', 'Oiled nubuck leather and CORDURA® fabric mesh uppers combine protection and breathability to keep your feet dry and comfortable', 'B-DRY waterproof/breathable membranes let sweat escape while keeping moisture out', 'REPREVE® laces and webbing are made of recycled PET polyester', 'Micro-injected polyurethane window underlay', 'O FIT Insoles™ offer exceptional fit, feel and performance', 'Adaptive Cushioning Technology midsoles with TPU heel counters increase comfort', 'Nylon shanks offer protection underfoot, increasing sure-footedness on varied terrain', 'True Tread rubber outsoles offer improved traction']"
Salomon X Ultra 4 Mid GORE-TEX Hiking Boots - Men's,Salomon,$165.00,"Power through uphills and descents in any weather with Salomon X Ultra 4 Mid GORE-TEX men's hiking boots. They give you the stability and grip you need, plus a higher cut for extra ankle support.",4.0,https://www.rei.com/media/fbd5923f-8219-4492-a34d-b46bbf515407?size=784x588,"['Backed up by waterproof/breathable GORE-TEX® protection', 'Drawing on Salomon trail-running expertise, these hiking boots are light and agile to keep you nimble on uneven terrain', 'SensiFit™ cradles the feet from the midsoles to the lacing system, providing a secure, snug and virtually customized fit all around your feet', 'Active Support ""mobile wings"" help hold your feet in place and accompany their movement, adapting to their shape and volume', 'ADV-C chassis target articulations on the outer foot to optimize stability while keeping the fronts of the shoes flexible', ""Contagrip® MA outsoles grab the terrain, even when it's wet or slippery, giving you more control, especially on descents"", 'Durable outsoles can handle a wide variety of surfaces, balancing the geometry and rubber compound to deliver confidence on wet, dry, hard or loose surfaces']"
HOKA Kaha 2 GTX Hiking Boots - Men's,HOKA,$240.00,"With a remarkable weight-to-cushion ratio, the men's HOKA Kaha 2 GTX hiking boots are cushioned, durable and adventurous for peak performance with peak plushness.",4.3,https://www.rei.com/media/fdea18eb-f13b-4a9e-be37-5b44c225ab9f?size=784x588,"['Waterproof nubuck leather uppers; leather is from a certified Leather Working Group (LWG) gold-rated tannery', 'Trailblazing silhouette employs GORE-TEX footwear fabric with recycled textile for waterproof/breathable protection', 'Updated with HUBBLE® heels with SwallowTail™ geometry, these durable hikers feature Vibram® Megagrip rubber with Traction Lug for increased ground contact', 'Topically applied PFC-free water repellency treatment adds extra protection from wet weather', 'Mesh and polyester laces are made with recycled content', 'Quick-lace metal top hooks', 'Abrasion-resistant toe caps and heels', 'Anatomic Achilles construction with heel pull tabs', 'Molded polyurethane sockliners are made with 50% soybean oil', 'Late stage Meta-Rocker with integrated flex grooves', 'Vibram Megagrip rubber outsoles with Traction Lug design feature 5 mm lugs']"
HOKA Speedgoat Mid 2 GTX Hiking Boots - Men's,HOKA,$170.00,These speed hikers get an upgrade with GORE-TEX® protection and more ankle support. The HOKA Speedgoat Mid 2 GTX boots with Vibram® Megagrip outsoles are a force to be reckoned with any day.,4.3,https://www.rei.com/media/5dddbf63-f3fa-4f65-970c-2814de543854?size=784x588,"['Lightweight and breathable GORE-TEX® waterproof booties keep your feet dry in a variety of seasons and weather conditions; water-resistant mesh uppers fend off precipitation', 'Anatomically designed molded foam collars provide additional ankle support', 'Zonal rubber placement adds support and stability', 'Midsoles now feature a lightweight EVA foam for a more responsive ride', 'Wider forefoot offers a more stable ride and accommodating fit', 'Vibram® Megagrip rubber outsoles with 5mm stepped lugs help keep you stable on slippery, wet and uneven surfaces', '4mm heel-to-toe drop']"
Altra Lone Peak Hiker Hiking Boots - Men's,Altra,$150.00,"Wear 'em from trail to town. The men's Altra Lone Peak Hikers have full trail capabilities to handle heavy-duty hikes with a lightweight feel, but they're equally ready to explore the urban scene.",4.2,https://www.rei.com/media/f6a4d908-0152-416f-a0f6-549feb7a4f97?size=784x588,"['Altra EGO™ midsoles offer soft responsiveness on and off the trail', 'Altra signature FootShape™ toe boxes allow the toes to relax and spread out naturally and the big toe to remain in a straight position', 'Balanced Cushioning™ platforms place the heels and forefeet the same distance from the ground, which encourages low-impact landings', 'Stack height: 25 mm', 'DuraTread™ outsoles excel on dry dirt and rocky terrain']"
Salomon Cross Hike Mid GTX Hiking Boots - Men's,Salomon,$118.93,"Agile yet grippy, Salomon Cross Hike Mid GTX men's hiking boots sport seamless uppers and waterproof membranes to keep you on track wherever adventures take you, from the Lake District to Iceland.",3.5,https://www.rei.com/media/b5cbb6a9-3a75-4ce6-a666-308beb01f37b?size=784x588,"['Uppers feature seamless, closed-mesh construction and GORE-TEX waterproof/breathable membranes to help keep your feet dry', 'Anti-debris mesh and rubber stone guards add protection', 'Agile performance—inspired by Salomon trail-running expertise, these mid-cut hikers keep your feet close to the ground and extremely reactive', 'Mid-height design supports and cushions your ankles', 'Strong, minimalist Quicklace™ lacing allows one-pull tightening for easy on and off', '10 mm heel-to-toe drop', 'Contagrip® rubber outsoles with multidirectional chevron lugs give you extra grip on muddy terrain, while an optimized heel brake keeps you stable on those downhill climbs']"
Salomon X Ultra 4 GORE-TEX Hiking Shoes - Women's,Salomon,$150.00,Get ready to power through uphills and descents in any weather with the women's Salomon X Ultra 4 GORE-TEX hiking shoes. They give you the stability and grip you need to enjoy the trails.,3.8,https://www.rei.com/media/a040e005-83c4-4a84-aa78-3a2c9ad6f515?size=784x588,"['Backed up by waterproof, breathable GORE-TEX® protection', 'Women-specific design—made with softer materials, especially around the collars and heels, a lower-density chassis and women-specific last', 'Drawing on Salomon trail-running expertise, these hiking shoes are light and agile to keep you nimble on uneven terrain', 'SensiFit™ cradles the feet from the midsole to the lacing system, providing a secure, snug and virtually customized fit all around your feet', 'Active Support ""mobile wings"" help hold your feet in place and accompany their movement, adapting to their shape and volume', 'ADV-C chassis targets articulations on the outer foot to optimize stability while keeping the front of the shoe flexible', ""Contagrip® MA outsoles grab the terrain, even when it's wet or slippery, giving you more control, especially on descents"", 'Durable outsoles can handle a wide variety of surfaces, balancing the geometry and rubber compound to deliver confidence on wet, dry, hard or loose surfaces']"
Lowa Camino EVO GTX Hiking Boots - Men's,Lowa,$335.00,"Enjoy all-day, big-mile journeys in the updated Lowa Camino EVO GTX hiking boots. They deliver stability and comfort to get you through long treks, and the GORE-TEX membranes keep your feet dry.",5.0,https://www.rei.com/media/f79bf3b9-e1ce-4f9b-bd74-cf1728bff1ac?size=784x588,"['Updated from the previous version to include ankle ""patches"" that allow for more ankle flex when walking uphill and new outsoles that improve the boots\' rolling properties', 'This version also includes strategically placed cushioning under the heels and balls of the feet for better comfort', 'Nubuck leather uppers with GORE-TEX waterproof, breathable membranes provide reliable protection that keeps moisture out', 'X-Lacing® holds the lacing in place both horizontally and vertically, preventing slippage and pressure points', '2-zone lacing features independently adjustable lacing zones that customize lacing tension and allow special foothold lacing techniques', 'Lowa Flex® upper construction with freely moving, individually mounted lace hooks provides an adjustable fit and allows the lacing system to flex as you walk for comfort', ""Roller eyelets allow the laces to move freely when you're making adjustments"", 'Anatomically shaped and padded C4-Tongues improve ankle flex and decrease pressure points for all-day comfort', 'DuraPU® midsoles offer cushioning and rebound', 'Vibram® Apptrail outsoles provide excellent contact with the trail for sure grip']"
Asolo Agent Evo GV Hiking Shoes - Men's,Asolo,$220.00,"Asolo Agent EVO GV hiking shoes for men employ GORE-TEX® waterproof/breathable protection in a comfortable, ergonomic fit with solid support underfoot so you can enjoy hikes even on muddy trails.",4.2,https://www.rei.com/media/d08b4c2a-6427-4aad-8c33-719e50f176d3?size=784x588,"['Water-resistant suede leather uppers are lined with GORE-TEX waterproof, breathable membranes to keep your feet dry when hiking in wet conditions', 'EVA midsoles provide protection underfoot and comfort for all-day trail hikes', 'Vibram® Megagrip outsoles deliver surefooted traction on wet/slick hiking trails', 'Made in Europe']"
Salomon Cross Hike Mid GTX Hiking Boots - Women's,Salomon,$118.93,"Agile yet grippy, the Salomon Cross Hike Mid GTX women's hiking boots sport seamless uppers and waterproof membranes to keep you on track wherever you adventure, from the Lake District to Iceland.",4.1,https://www.rei.com/media/b3f69d47-7da9-44e0-b4a0-84d068453ecc?size=784x588,"['Uppers feature seamless, closed-mesh construction and GORE-TEX waterproof/breathable membranes to help keep your feet dry', 'Anti-debris mesh and rubber stone guards add protection', 'Agile performance—inspired by Salomon trail-running expertise, these mid-cut hikers keep your feet close to the ground and extremely reactive', 'Mid height supports and cushions your ankles', 'Strong, minimalist Quicklace™ allows 1-pull tightening for easy on and off', '10 mm heel-to-toe drop', 'Contagrip® rubber outsoles with multidirectional chevron lugs give you extra grip on muddy terrain, while an optimized heel brake keeps you stable on those downhill climbs']"
Oboz Sypes Mid Leather Waterproof Hiking Boots - Women's,Oboz,$160.00,"Built for versatility and designed with sustainable materials, the Oboz Sypes Mid Leather Waterproof women's hiking boots deliver support, comfort and around-town style to wear all day, every day.",4.4,https://www.rei.com/media/6a3c0b6b-b959-44ce-bf3e-ca55c877aca1?size=784x588,"['Waterproof nubuck leather uppers with Oboz B-DRY waterproof/breathable membranes help keep your feet dry in any weather', 'Gender-specific lasts address the anatomic nuances between different types of feet', 'Uppers also features CORDURA® AFT mesh fabric and supportive thermoplastic polyurethane (TPU) overlays', '100% recycled PET (rPET) REPREVE® laces and rPET webbing and linings are made with recycled materials', 'O FIT Insoles™ offer exceptional fit, feel and performance', 'BLOOM™ is a plant-based, performance-driven foam made with algae biomass; algae is renewable feedstock sourced from lakes and ponds at high risk of algal bloom', 'ACT (Adaptive Cushioning Technology) lightweight polyurethane midsoles provide durability, support and rebound for optimal comfort', 'TPU heel clips and nylon shanks provide additional support', 'Board-lasted']"
KEEN Targhee III Waterproof Mid Hiking Boots - Men's,KEEN,$174.95,"Trail-tested for over 15 years, the men's KEEN Targhee III Waterproof Mid hiking boots have a light, casual feel for everyday wear, plus rugged, waterproof protection for full days on the trail.",4.1,https://www.rei.com/media/7dd07e01-06f5-42ba-af2b-e82ff4d918e0?size=784x588,"[""Offering out-of-the-box comfort and a feel that's more like sneakers than traditional hikers, these boot can also be worn as comfort shoes"", 'Uppers are built to last with leather from a tannery rated gold by the Leather Working Group (LWG) for environmental stewardship and traceability', 'KEEN.DRY provides waterproof/breathable protection for hiking in any conditions', 'Toe and mud guards add durability', '4 mm multidirectional lugged soles deliver reliable, trail-ready traction', 'Original KEEN comfort fit provides plenty of room for toes to spread out and a secure heel for stability']"
Topo Athletic Trailventure 2 WP Hiking Boots - Women's,Topo Athletic,$180.00,"Take on any weather and any trail in the women's Topo Athletic Trailventure 2 WP. These light, rugged, waterproof hiking boots feature signature roomy toe boxes, plus even more cushioning than before.",4.6,https://www.rei.com/media/7dfb766a-4c18-45ad-bd41-f95d7d298c67?size=784x588,"['Full eVent® waterproof inner-bootie construction locks water out to keep your feet dry and comfortable in any weather condition', 'External TPU heel counters provide heel support and keep the feet secure over the cushioned platform', 'Antimicrobial OrthoLite® insoles offer additional comfort underfoot with odor resistance', '33 x 28 mm cushioned platforms feature ZipFoam™ midsoles for an even more stable and comfortable experience underfoot', 'Full-length ESS rock plates offer total protection from rocks and roots on technical terrain', 'Vibram® Megagrip outsoles offer superior traction and grip on all surfaces, including wet and slippery terrain, while generously spaced lugs optimize mud and snow release', 'Compatible with Topo Performance Gaiters (not included)']"
Altra LP Alpine Shoes - Men's,Altra,$150.00,"Ready, set, go anywhere. The men's Altra LP Alpine shoes are retro-style hikers with all-day versatility, ready to take you from town to trail and back.",4.4,https://www.rei.com/media/f46021e2-2ef2-4654-b004-27f159afd0f4?size=784x588,"['Uppers made with leather sourced from a tannery rated gold by the Leather Working Group', 'FootShape™ toe boxes allow toes to splay for natural foot positioning and comfort', 'Altra EGO™ midsoles with BLOOM™ foam—a natural material made from algae—provide underfoot support with a sustainable twist', 'BLOOM algae is renewable feedstock sourced from lakes and ponds at high risk of algal bloom', 'Balanced Cushioning™ platform places heel and forefoot the same distance from the ground (0 mm heel-to-toe drop) for natural alignment and low-impact landing', '5 mm contour footbeds provide support', 'DuraTread™ rubber outsoles excel on dry dirt and rocky terrain', 'Stack height: 25 mm']"
